Nom,Pochette,Statut,Auteur,Auteurs,Genre,Durée,Somme,Synopsis,Note,Site,Langue,MP3,Website,Youtube,RSS,Soundcloud,Spotify,Discord,Récompense,Citation
L'Appel des abysses,abysses.jpg (https://dl.airtable.com/.attachments/89fafe97a93ffebb48df1a00553a84cc/db78dd07/abysses.jpg),Terminé,"Cyril Legrais,Juliette Rose,France Culture","Cyril Legrais,Juliette Rose,France Culture",Science-Fiction,2:21,2:21,"L'océan a recouvert les continents. L'air est devenu irrespirable. L'élite financière s'est réfugiée dans la Cité, un agrégat de sous-marins reclus dans les abysses. À la surface, les plus pauvres étouffent sur le Territoire, un immense bidonville flottant où gronde la révolution. Marin, 16 ans, n'a connu que la pollution et le sentiment d’injustice. Il survit auprès de sa mère et de sa sœur adoptives en plongeant chaque jour pour récupérer nourriture et matériel. Lorsqu'il apprend qu'il est le fils de Léonie Montreuil, la Présidente de la Cité immergée, Marin perd pied. Et tandis que les siens se révoltent pour gagner leur place dans les profondeurs, il s'efforce de renouer avec son passé sans renier qui il est.",5,https://www.franceculture.fr/emissions/l-appel-des-abysses,Français,checked,https://www.franceculture.fr/emissions/l-appel-des-abysses,,https://radiofrance-podcast.net/podcast09/rss_19766.xml,,,,,
L'attentat en direct,attentat-direct.jpg (https://dl.airtable.com/.attachments/4f70f6cedd3ba93fd5d0dd3dde22a053/24cbd338/attentat-direct.jpg),Terminé,"Claude Ollier,Georges Peyrou",,"Historique,Policier",0:56,0:00,"""L'attentat en direct"" est une pièce de Claude Ollier  inspirée de l'assassinat de John Fitzgerald Kennedy : un amiral est assassiné, lors d'un défilé retransmis par une station de radio ""radio Alpha"" dont le reporter prend en chasse l'assassin ; les spots publicitaires qui émaillent la pièce sont interprétés par Jean Yanne avec sa verve habituelle.",5,https://www.franceculture.fr/emissions/fictions-samedi-noir/lattentat-en-direct-de-claude-ollier,Français,checked,https://www.franceculture.fr/emissions/fictions-samedi-noir/lattentat-en-direct-de-claude-ollier,,,,,,,
L'École des Loisirs à écouter,ecole-loisirs.jpg (https://dl.airtable.com/.attachments/96f1032080c92902972c8dbe1336a309/9183035f/ecole-loisirs.jpg),Terminé,Paradiso,,Enfant,0:00,0:00,"Découvrez les histoires intemporelles et emblématiques de L’école des loisirs dans vos oreilles. Retrouvez les aventures sensibles, drôles et rocambolesques des héros de vos enfants. Embarquez avec nous au pays des histoires !",,https://paradisomedia.io/fr/programmes,Français,checked,https://paradisomedia.io/fr/programmes,,,https://soundcloud.com/paradisopodcasts/10-au-lit-les-affreux,https://open.spotify.com/show/3F8ABCSgC3KxBfrqVCHUOA?si=jSDR23llSjuL9euEOvYtmQ&nd=1,,,
L'employé,employe.jpg (https://dl.airtable.com/.attachments/4784f40476627b0ae57425930c3749ea/734a039e/employe.jpg),Terminé,Victor Bonnefoy,Victor Bonnefoy,Science-Fiction,2:55,2:55,"Dans un État totalitaire, un climat de tension plane, les lois répressives se succèdent. Alors que les arrestations se multiplient, l'Employé gère les cas les plus sensibles. Il a carte blanche pour les ramener dans le droit chemin.",5,https://open.spotify.com/show/4eG0p1ECR2jxiMAg9YGJaE?si=r8qlGesjTeOQvRoF6Om4Lg&nd=1,Français,,,,,,https://open.spotify.com/show/4eG0p1ECR2jxiMAg9YGJaE?si=r8qlGesjTeOQvRoF6Om4Lg&nd=1,,,
L'épopée de l'outre tombe,outre-tombe.jpg (https://dl.airtable.com/.attachments/290dd3310187ac4556bbe0aeb1799c04/75709032/outre-tombe.jpg),En cours,StupHorror,,"Horreur,Fantastique,Humour",0:00,0:00,,,https://www.youtube.com/playlist?list=PLIbbmZIwh-wtGq0KO7tRxLaPn_ji8UJNs,Français,,,https://www.youtube.com/playlist?list=PLIbbmZIwh-wtGq0KO7tRxLaPn_ji8UJNs,,,,,,
L'épopée temporelle,epopee1.jpg (https://dl.airtable.com/.attachments/8edc6d45f28bdafb5a6121c18968db4f/212ce595/epopee1.jpg),Terminé,Cyprien,Cyprien,"Humour,Science-Fiction",3:32,3:32,"Thomas, un jeune homme sans énergie ni charisme, reçoit la visite d'un robot, Eliott (dit aussi KB28). Ensemble, ils partent dans une folle aventure à travers le temps à la recherche d'Iris, l'ex-petite amie de Thomas, et du père de celle-ci, un scientifique mystérieux. Leur voyage les transportera du Moyen-Âge à l'Allemagne nazie, en passant par beaucoup d'autres époques.",5,https://www.youtube.com/watch?v=XZnySZWeSJM&list=PLN-TcjS0qZKXFfIUWXxv9bvs19868yJiJ,Français,,,https://www.youtube.com/watch?v=XZnySZWeSJM&list=PLN-TcjS0qZKXFfIUWXxv9bvs19868yJiJ,,,,checked,,
L'Histoire de France (PLC),hdfplc.jpg (https://dl.airtable.com/.attachments/775b4c299f3e9ecaa881e7b5275bd3fb/0b4be723/hdfplc.jpg),Abandonné,L’apéro du Captain,,"Historique,Humour",1:16,1:16,"L'ADC vous propose de découvrir l'histoire de France de façon ludique grace à ses épisodes chronologiques qui retracent l'histoire de notre pays, de la préhistoire à nos jours.",5,https://podcasts.apple.com/fr/podcast/lhistoire-de-france/id726061567,Français,checked,https://podcasts.apple.com/fr/podcast/lhistoire-de-france/id726061567,,,,,,,
L'invitation,invitation.jpg (https://dl.airtable.com/.attachments/c77ba8f0877402efa4e111318c6a32b6/fc43d7fc/invitation.jpg),Terminé,Lorendil,,Humour,0:16,0:00,"Camille invite Hector à dîner, et son corps est tout chamboulé.",5,https://2020.sagadelete.fr/saga/linvitation,Français,checked,https://2020.sagadelete.fr/saga/linvitation,,,,,,,
L’Apocalypse est notre chance,apocalypse.jpg (https://dl.airtable.com/.attachments/2aab9b59d414c1e65ba85d7e89c8a9be/8b499562/apocalypse.jpg),Terminé,"Sylvie Coquart-Morel,Sophie Maurer,France Culture",,Policier,6:14,0:00,"Intrigues à l'université, où Laura découvre son directeur de thèse mort dans son bureau. Une balle dans la tête. Laura va mener sa propre enquête au sein de l’université, mais ce qu’elle découvre la bouleverse. ",5,https://www.franceculture.fr/emissions/fictions-le-feuilleton/lapocalypse-est-notre-chance-de-sylvie-coquart-morel-et-sophie,Français,checked,https://www.franceculture.fr/emissions/fictions-le-feuilleton/lapocalypse-est-notre-chance-de-sylvie-coquart-morel-et-sophie,,https://radiofrance-podcast.net/podcast09/rss_11495.xml,,,,,
L’Homme à l’Oreille coupée,oreille.png (https://dl.airtable.com/.attachments/ed9b569bceb06ec5729fb546828d76fa/13db3f84/oreille.png),Terminé,"Naïde Lancieaux,Jean-Claude Mourlevat,Belisair House",,Tranche-de-vie,0:27,0:00,"Dans une taverne en Norvège, un homme intrigue beaucoup les autres clients : tous les soirs depuis des années, il occupe la même place, assis dans un coin obscur de la pièce. Il lui manque une oreille… et chaque soir, quand on lui demande comment il l’a perdue, le vieil homme raconte une histoire différente. Saura-t-on un jour la vérité ?",5,http://belisairhouse.net/feuilletons/lhomme-a-loreille-coupee/,Français,checked,http://belisairhouse.net/feuilletons/lhomme-a-loreille-coupee/,https://www.youtube.com/watch?v=dg9Ao246aXE&list=PLfi_VJycpVzSCM38_axK1yWcIQCx4E0PD,,,,,,
L’incroyable expédition de Corentin Tréguier au Congo,expedition.jpg (https://dl.airtable.com/.attachments/3d8f5d5ab9f024bfb461fe5d2c21a2e9/9a5c94db/expedition.jpg),Terminé,"Emmanuel Suarez,Sophie-Aude Picon",,"Historique,Science-Fiction",2:19,0:00,"Paris, 1872. Corentin Tréguier, officier sans talent militaire mais passionné de botanique, est choisi pour diriger une expédition secrète afin de retrouver le Pr Delescluze, un grand scientifique français disparu pendant une mission sur les rives du fleuve Congo. On craint  qu’il ne se soit transformé en singe : l’honneur de la Nation et les ambitions africaines de la France sont en danger ! De son côté, le directeur du ""Télégraphe Wallon"" engage Camille de Willers, une jeune aventurière, pour infiltrer la mission et permettre au roi des Belges de gagner la course au Congo. De Nantes à la jungle congolaise, l’expédition prend une tournure rocambolesque, et rien n’est épargné à nos improbables explorateurs. Mais c’est un secret auquel nul ne  s’attendait qui leur est révélé au cœur de la forêt...",5,https://www.franceculture.fr/emissions/lincroyable-expedition-de-corentin-treguier-au-congo,Français,checked,https://www.franceculture.fr/emissions/lincroyable-expedition-de-corentin-treguier-au-congo,,,,,,,
La Bible relue par Dieu,dieu.png (https://dl.airtable.com/.attachments/95a1e3dcb8cc9d32f54259b8ba09a9d0/82e934fa/dieu.png),Terminé,"Qualiter,FibreTigre",,Humour,1:37,0:00,"Pour sa nouvelle Fiqtion, Qualiter donne le micro à Dieu qui se propose de relire la Bible avec nous et de nous dévoiler les coulisses de l'histoire divine.",5,http://dequaliter.com/,Français,checked,http://dequaliter.com/,,https://rss.acast.com/fiqtion,,https://open.spotify.com/show/30tdjVW84cMnYeqxvc5WwN,,,
La Breluche dorée,breluchelogo1400x1400.png (https://dl.airtable.com/.attachments/61b627ddad1edf9db17437d2865c1043/8791bb5d/breluchelogo1400x1400.png),Terminé,Walter Proof,,"Humour,Policier,Action",1:29,0:00,"Deux détectives privés (de tout sens commun surtout) se retrouvent plongés dans une série d'aventures totalement invraisemblables, à la recherche d'un mystérieux artéfact baptisé la Breluche dorée.",,https://www.linaudible.com/category/la-breluche-doree/,Français,,https://www.linaudible.com/show/la-breluche-doree/,,https://breluche.lepodcast.fr/rss,,,,,
La Chaleur de l’endroit,chaleur.jpg (https://dl.airtable.com/.attachments/8f6da0fd104b7ffe471c26df6c2f6d9b/e4bf8f47/chaleur.jpg),Terminé,Nylon Steel Production,,Horreur,0:23,0:00,C'est une histoire inquiétante qui se déroule en haute montagne. Il semble qu'un mystérieux personnage rôde dans la montagne et assassine les randonneurs...,5,https://nylonsteel.wixsite.com/nylonsteel/fiction-audio,Français,checked,https://nylonsteel.wixsite.com/nylonsteel/fiction-audio,https://www.youtube.com/watch?v=P4lDE-uE0Ag,,https://soundcloud.com/user-588290905/la-chaleur-de-lendroit,,checked,,
La Couleur tombée du ciel,couleur.jpg (https://dl.airtable.com/.attachments/13fab819dac6c3d4572fa27219905add/d2fd0f01/couleur.jpg),Terminé,Étienne Valles,,"Horreur,Fantastique",0:59,0:00,"Prospectant autour de la ville d’Arkham, Massachusetts, un jeune géomètre entend parler de faits étranges qui ont eu lieu trente ans auparavant et qui effraient encore les habitants de la région. Il rencontre alors Ammi Pierce, l’unique témoin de ce qui s’est déroulé dans la Lande foudroyée à la suite de la chute d’un météorite. Ammi raconte qu’à la suite de ça, une multitude d’événements insolites et troublants se sont produits autour de la ferme de Nahum Gardner. Ces évènements n’étant que les prémices d’une véritable horreur...",5,https://www.franceculture.fr/emissions/fictions-samedi-noir/la-couleur-tombee-du-ciel-de-howard-phillips-lovecraft,Français,checked,https://www.franceculture.fr/emissions/fictions-samedi-noir/la-couleur-tombee-du-ciel-de-howard-phillips-lovecraft,,,,,,,
La Descente,descente.jpg (https://dl.airtable.com/.attachments/61550de5970d9043ad4627b71f775e33/6ad344c6/descente.jpg),Terminé,DestroKhorne,,"Post-apo,Policier",0:25,0:00,Deux Hommes. Un chasseur et sa proie. Dans un complexe désaffecté. Non... Quelque chose ne va pas. Qui est le chasseur ? Qui est la proie... Et pourquoi y a-t-il cette odeur constante de Kérosène ?,5,http://www.lorchestredelhumour.fr/index.php?view=descente,Français,checked,http://www.lorchestredelhumour.fr/index.php?view=descente,,,,,,Saga de l'été,
La fin de Fantômas,fantomas2.jpg (https://dl.airtable.com/.attachments/b1fed0379360550bc856af5c3f54a18b/d642bff2/fantomas2.jpg),Terminé,"Jean-Matthieu Zahnd,Xavier Maumejean",,Policier,0:58,0:00,"Si le juge Bonnet se félicite de la résolution des crimes de lord Bentham et de la marquise de Langrune, l’inspecteur Juve ne retient que l’évasion du Maître de l’Angoisse. Le jeune journaliste Jérôme Fandor pourrait bien avoir retrouvé sa trace. Jusqu’alors, il ne s’agissait que d’une répétition générale, à présent Fantômas étend au monde son théâtre du crime. Ses adversaires, mais aussi la jolie Hélène et Lady Beltham en sont les acteurs. Du grand magasin Paris-Galeries où se joue un massacre au palais du roi d’Espagne détruit par  les bombes, Fantômas dirige le drame avant de conclure sur une scène à sa démesure : le paquebot Gigantic qui s’élance vers les banquises flottantes. ",5,https://www.franceculture.fr/emissions/fictions-samedi-noir/la-fin-de-fantomas-de-pierre-souvestre-et-marcel-allain,Français,checked,https://www.franceculture.fr/emissions/fictions-samedi-noir/la-fin-de-fantomas-de-pierre-souvestre-et-marcel-allain,,,,,,,
La Fleur & le Sabre,,Terminé,Tatu_Philosophe,,"Action,Historique",0:35,0:00,Femme. Métisse. Lame. Découvrez l'histoire de Naoko Indil tandis qu'elle tente de s'affirmer dans un monde où elle n'est pas bienvenue.,5,https://2019.sagadelete.fr/saga/la-fleur-le-sabre,Français,checked,https://2019.sagadelete.fr/saga/la-fleur-le-sabre,,,,,,,
La Légende de l'Ankou,ankou1.png (https://dl.airtable.com/.attachments/deef242ae9d94d06fe02ced6993f8628/544525f3/ankou1.png),Terminé,"Naïade Lancieaux,Belisair House",Naïade Lancieaux,"Historique,Fantastique",3:44,3:44,"Une fois de plus, l’Ankou sort de son repaire. La mort va chercher ses âmes. Mais il y a un problème; la mort n’arrive plus à tuer, elle ne parvient plus à convaincre les âmes à la suivre jusqu’à son antre, dans les monts d’Arrée. Elle s’apitoie même sur leur sort, elle se laisse gagner à leurs lamentations et ne cherche plus à empêcher leur fuite. Mais que lui arrive-t-il ? La mort serait-elle en train de faiblir, de vieillir ? Et si la mort mourrait à son tour ?",5,http://belisairhouse.net/feuilletons/la-legende-de-lankou/,Français,checked,http://belisairhouse.net/feuilletons/la-legende-de-lankou/,https://www.youtube.com/watch?v=bcc0CJkJbQc&list=PLfi_VJycpVzQuXeTpUAU82wUVfoY0ufTF,http://legende-de-lankou.lepodcast.fr/rss,,,,,
La légende de Xantah,xantah.jpg (https://dl.airtable.com/.attachments/809c6582aad988a41db13b7a63147382/36b5aa29/xantah.jpg),En cours,"Nico,Matt","Nico,Matt","Science-Fiction,Humour",3:37,3:37,"L’équipage d’un vaisseau retrouve une capsule de sauvetage à la dérive dans l’espace depuis plus de 300 ans. Ce qu’ils découvriront à l’intérieur les précipitera dans une périlleuse quête commencée des siècles auparavant : La poursuite de Xantah, un astre légendaire convoité par les plus grandes puissances de la galaxie.",5,https://www.capitainegloomy.com/episodes/,Français,checked,https://www.capitainegloomy.com/episodes/,https://www.youtube.com/watch?v=fpEOWWYMG2E&list=PLSnTq-EUC-Z5ZocJXA3iDDIb0Y839Anr1,https://www.capitainegloomy.com/feed/saga-mp3,https://soundcloud.com/adopxantah/sets/legendexantah,,,,
La Mort d'Achille,achille.jpg (https://dl.airtable.com/.attachments/c1ef7f3ea8bb43e08db147294366713d/c92435e5/achille.jpg),Terminé,Wajdi Mouawad,,Historique,1:00,0:00,"Dix ans durant, les guerriers grecs se sont battus, affrontant, dans les plaines d’Ilion les guerriers troyens, sans parvenir à détruire leur cité. Dix ans à être tenus en échec par la résistance obstinée d’Hector, voyant perdurer une guerre qui interdisait tout espoir de retour. Que s’est-il alors passé dans le cœur de ces guerriers lorsque, finalement, grâce à la ruse du cheval de bois, ils réussirent à pénétrer dans l’enceinte de la cité de Priam et, fous de colère, avec le désir d’en finir, ils ont fait face à des enfants, des femmes et à l’ensemble des civils troyens ? Cette question a fait ressurgir le spectre des massacres de Sabra et Chatila, plaie ouverte dans l’histoire de mon pays natal et, tout à coup, il m’est apparu évident que pour les Grecs de cette époque éloignée autant que pour les miliciens chrétiens libanais de 1982 ou ceux qui ont commis les crimes de Srebrenica, il a existé un instant de folie qui n’a eu de cesse de se reproduire selon les mêmes gestes, dans la même chorégraphie macabre. Une transmission de la sauvagerie. Toujours, à toutes les époques, il y a cet instant où tout s’effondre dans l’ivresse du sang et la démesure de la bestialité. Comment après de telles nuits, continuer sans se poser la question des dieux et celle de l’enchantement du monde ?",5,https://www.franceculture.fr/emissions/fictions-theatre-et-cie/la-mort-dachille-texte-inedit-de-wajdi-mouawad,Français,checked,https://www.franceculture.fr/emissions/fictions-theatre-et-cie/la-mort-dachille-texte-inedit-de-wajdi-mouawad,,,,,,,
La Petite Souris,souris.jpg (https://dl.airtable.com/.attachments/c9a906d2ce43eba61ec0661b342e9140/30e6fb26/souris.jpg),Terminé,"Adelfleur,Javras",Adelfleur,Enfant,0:08,0:08,"Camille a enfin perdu sa première dent. Sa maman lui raconte que la petite souris vient chercher les dents de lait pendant la nuit et laisse un petit cadeau en échange. Mais pourquoi ces dents sont-elles aussi importantes ? La copine d’école de Camille, Maeva, a-t-elle raison de ne pas croire à cette histoire ?",5,https://javras.fr/2020/02/02/la-petite-souris/,Français,checked,https://javras.fr/2020/02/02/la-petite-souris/,,,,,,,
La préhistoire du futur ,prehistoire.webp (https://dl.airtable.com/.attachments/d863363e1d22ff84b68680a4038e305e/82bc9328/prehistoire.webp),Terminé,Benjamin Abitan,,"Science-Fiction,Humour",1:11,0:00,"La Préhistoire du futur est une fresque d’anticipation épique et grandiose qui recommence à chaque fois en 2016 et ne finit jamais, mêlant droits civiques des robots, futur-Futuroscope, zombies reprenant Hamlet et dinosaures mangeant des pirates dans des mondes parallèles.",5,https://www.franceculture.fr/emissions/fictions-la-vie-moderne/la-prehistoire-du-futur-de-et-realisee-par-benjamin-abitan,Français,checked,https://www.franceculture.fr/emissions/fictions-la-vie-moderne/la-prehistoire-du-futur-de-et-realisee-par-benjamin-abitan,,,,,,,
La relique du Mont Courroux,relique.jpg (https://dl.airtable.com/.attachments/9e7df9a957a18b6ee681dfbba8312909/8f01193b/relique.jpg),Terminé,Aravane,,Fantasy,2:51,0:00,"Depuis qu'il s'est fait dérober une relique, Ernest ""de la maison vide"" erre dans les alentours de sa cité d'origine, la cité fortifiée de Samarra. L'histoire débute lorsque Ernest arrive à Lanovia, bourgade du canton d'Alan.",5,https://wiki.netophonix.com/La_relique_du_Mont_Courroux,Français,checked,https://wiki.netophonix.com/La_relique_du_Mont_Courroux,,,,,,,
La Traversée de Faëria,faeria.jpg (https://dl.airtable.com/.attachments/8ddaf3a4a0c07a8fc76e09d0442f930e/eafcfdd8/faeria.jpg),Terminé,"Paul Hourlier,Audiodidact",,Fantasy,0:00,0:07,"Après avoir rencontré un vieil ermite à flanc de falaise, vous lui racontez l'histoire de votre voyage à travers les terres de Faëria. Rencontres insolites, combats épiques, amitiés, guerre, magie... Vous arpenterez les 4 coins de Faëria à la recherche des 4 pierres magistrales de puissance. Pourquoi ? Comment ? A vous de le découvrir... Mais prudence sur la route, car les recoins sombres du monde connu de Faëria peuvent cacher bien des dangers...",5,https://forum.netophonix.com/ftopic18350.html,Français,checked,https://forum.netophonix.com/ftopic18350.html,https://www.youtube.com/watch?v=4bBomlFtkUc&list=PLRPiA_JV--XdLciDCf9HGafzdPcAWkuNV,,,,checked,,
La vie secrète de Colibacille,colibacille.jpg (https://dl.airtable.com/.attachments/182a65c37a8114a4c26f13fadbbe0f7c/e3de7e5f/colibacille.jpg),Terminé,Walter Proof,,"Humour,Policier",2:26,0:00,"Le serveur central de la Global Corporation, multinationale tentaculaire, a été piraté. Colibacille Espérandieu, aventurière et ethnologue de renom, est engagée pour faire toute la lumière sur l'affaire.",5,https://www.linaudible.com/show/la-vie-secrete-de-colibacille/,Français,checked,https://www.linaudible.com/show/la-vie-secrete-de-colibacille/,,https://wproof.libsyn.com/rss,,,,,
Le bruit du monde,bruit-monde.jpg (https://dl.airtable.com/.attachments/91d754d83d3aaebe026f77a48e42437c/dddb7cc8/bruit-monde.jpg),Terminé,"Stéphane Michaka,Juliette Heymann",,Fantastique,0:58,0:00,Ça va pas être de la tarte.,5,https://www.franceculture.fr/emissions/fictions-samedi-noir/le-bruit-du-monde-de-stephane-michaka-0,Français,checked,https://www.franceculture.fr/emissions/fictions-samedi-noir/le-bruit-du-monde-de-stephane-michaka-0,,,,,,,
Le Cacao Qui Tue,cacao.jpg (https://dl.airtable.com/.attachments/11a313eec857e45d6a5b247ffc5ced92/c264dd7a/cacao.jpg),Terminé,"Hélène Martin,Sébastien Viaud",,Pirate,2:51,0:00,Suivez les aventures de nos pirates à la recherche du mystérieux Cacao Qui Tue !,,http://www.lecacaoquitue.fr/accueil,Français,checked,http://www.lecacaoquitue.fr/accueil,https://www.youtube.com/channel/UCczIBe-8foU6Vvmd-mEFpSg/videos,,,,,,
Le Chat du Rabbin,rabbin.webp (https://dl.airtable.com/.attachments/c625a6dcb1533146bffc4e6f6f56f752/8c0a0452/rabbin.webp),Terminé,France Culture,,"Humour,Licence,Tranche-de-vie",4:01,0:00,"Le chat du rabbin n’est pas un chat comme les autres. Non seulement il est doué d’un esprit critique décapant dans cette Algérie du début du XXe siècle, mais en plus la faculté de parole lui vient après qu’il a soudain dévoré le perroquet de son maître.",5,https://www.franceculture.fr/emissions/fictions-le-feuilleton/le-chat-du-rabbin-de-joann-sfar-0,Français,checked,https://www.franceculture.fr/emissions/fictions-le-feuilleton/le-chat-du-rabbin-de-joann-sfar-0,,,,,,,
Le Chevalier Bourré,chevalier.jpg (https://dl.airtable.com/.attachments/9fad348dfe10af5f630d754175180a35/1597dc11/chevalier.jpg),Terminé,Fal,Fal,"Fantasy,Musical",5:10,5:10,"Lorsqu'il se fait adouber par une belle matinée de printemps, Olivier, jeune chevalier perpétuellement éméché (souvent ivre mort), veut donner un sens à sa vie. Mais il n'a pas un seul instant idée des aventures qu'il va vivre. Des rencontres malencontreuses, des kidnappings foireux, la colère d'un Dieu fou à lier, et celle d'un Roi con à souhait. Il se pourrait même qu'il ait à affronter la mort.",5,http://chevalierbourre.studiosfal.com/,Français,checked,http://chevalierbourre.studiosfal.com/,https://www.youtube.com/watch?v=XxmYwHKfF4Y&list=PLMTSO5fLj_86EbfSI5BNdIjLgyLK2Iq0n,http://chevalierbourre.lepodcast.fr/rss,,,,,
Le Dernier Souffle des Zéphyrs,zephyrs.png (https://dl.airtable.com/.attachments/ccc1ba7841764ebc253723850b67aa3e/2b04ff53/zephyrs.png),Terminé,Valkyria,Valkyria,Science-Fiction,0:26,0:26,"2830 : Alors que la Terre est entièrement recouverte de neige et de glace, Owen traque et élimine les Zéphyrs... Ces dragons vagabondent sur Terre et seraient à l'origine du froid ambiant. Clivia, I.A. intégrée à l'armure et l'arme d'Owen, l'accompagne dans ses traques. Elle est à la fois une alliée de taille pour le repérage et l'élimination des créatures mais aussi une amie dont Owen ne se séparerait sous aucun prétexte.",5,https://derniersouffledeszephyrs.jimdofree.com/,Français,checked,https://derniersouffledeszephyrs.jimdofree.com/,https://www.youtube.com/watch?v=u1YyO_67DmA,,,,checked,Nuit Sans Image,
Le dictaphone,,Terminé,Bertrand,,Policier,0:28,0:00,"J'ai une question pour vous : qu'auriez-vous fait à ma place si un soir alors qu'en rentrant après avoir tapé le carton avec vos potes quelqu'un trouvait dans la rue un dictaphone, le laisseriez-vous là ou le ramasseriez-vous ? Et si je vous disais que chaque piste donnait une date et un commentaire du style ""je l'ai fait"" sur un ton de remords ? Et manque de bol, moi je suis détective.",5,https://2020.sagadelete.fr/saga/le-dictaphone,Français,checked,https://2020.sagadelete.fr/saga/le-dictaphone,,,,,,,
Le donjon de Naheulbeuk,naheulbeuk.gif (https://dl.airtable.com/.attachments/804b1bbbe1bcfa7d1ca5cf69b433cf8f/8b1800fe/naheulbeuk.gif),En cours,Pen of Chaos,Pen of Chaos,"Humour,Fantasy,Musical",6:06,6:06,"Une compagnie constituée de personnages tous plus imbéciles les uns que les autres va s'aventurer dans un donjon mystérieux pour aller chercher une statuette mystérieuse et ensuite la remettre à un commanditaire mystérieux, en échange de 8000 pièces d'or. Mais cette quête s'avérera bien plus difficile que prévu...",5,http://www.penofchaos.com/warham/donjon-telecharge.htm,Français,checked,http://www.penofchaos.com/warham/donjon-telecharge.htm,,,,https://open.spotify.com/album/679Sg2BwyAyIRAMDyxVD6j,,,"Elfe, Nain:Elfe : Je suis nyctalope !
Nain : Je le savais bien que t'étais une salope !

Ranger, Nain:-Ranger : Y a personne ici !
-Nain : C´est vrai on se croirait dans le cerveau d´un elfe."
Le Journal De Chance : Après l’Accident,journal-chance.jpg (https://dl.airtable.com/.attachments/b333684eb6ba831c3ecf70d7bffb2aef/ca6b221d/journal-chance.jpg),Terminé,"Samuel Genin,Gulix",,Post-apo,1:13,0:00,Fiction Audio d’après le jeu de Gulix.,5,https://samuelgenin.bandcamp.com/album/le-journal-de-chance-apr-s-l-accident-fiction-audio-d-apr-s-le-jeu-de-gulix,Français,checked,https://samuelgenin.bandcamp.com/album/le-journal-de-chance-apr-s-l-accident-fiction-audio-d-apr-s-le-jeu-de-gulix,,,,,,,
Le Menhir d'or,menhir.png (https://dl.airtable.com/.attachments/6a1d2516abead29956d655f07e081e3e/b967b009/menhir.png),Terminé,Éditions Albert René,,"Licence,Humour,Musical",0:31,0:00,"Au Village, l’agitation règne : Assurancetourix a décidé de participer au célèbre concours de chant des bardes gaulois pour remporter le Menhir d’Or. Pour le protéger dans cette compétition suivie de près par les Romains, Astérix et Obélix sont chargés de l’accompagner… quitte à y perdre une oreille !",5,https://www.asterix.com/la-collection/les-albums-illustres/le-menhir-dor/,Français,checked,https://www.asterix.com/la-collection/les-albums-illustres/le-menhir-dor/,,,,,,,
