Nom,Pochette,Statut,Auteur,Genre,Durée,Durée d'écoute,Synopsis,Note,Site,Langue,Dernier épisode,MP3,Website,Youtube,RSS,Soundcloud,Spotify,Discord,Récompense,Citation,Recommandation,Bande-annonce,NSI 2022,NSI 2023,Message Insta,Auteurs
Dracula (concert-fiction),dracula.jpg (https://v5.airtableusercontent.com/v1/18/18/1689292800000/UPI5Dvh6hl6Y075GiCgj2A/5MQaA9vgre16Mpa_ZT83Yo5rqOXawfUgdosiyeBh8qRAcLjPfOOIBc_h5-6wSTou_XEKpue5RvZlRH0rd8NIs5bKE5tElKm5Z6keg5Nlqzc/Nvvmux5CJbfGxMQn_J_gsb52LduCnC4KO_oru1q0HXk),Terminé,"Stéphane Michaka,France Culture","Licence,Fantastique,Horreur",0:58,58 min,"Transylvanie, 1893. Invité du comte Dracula dans son château des Carpates, Jonathan Harker ne tarde pas à comprendre qu’il est prisonnier de son hôte. Dracula signe l’acte de vente qui le rend propriétaire d’une abbaye en Angleterre, puis il embarque sur une goélette avec des dizaines de caisses chargées de terre. Dans l’hôpital où il est soigné après son terrifiant séjour chez Dracula, Jonathan est rejoint par sa fiancée, la ravissante Mina. Rentrés à Londres, Mina et Jonathan reçoivent la visite d’un certain Van Helsing. Il leur apprend que Dracula a débarqué en Angleterre. Pour Mina Harker, c’est le début d’une lutte à mort avec le vampire… mais aussi avec ses propres démons.",,https://www.radiofrance.fr/franceculture/podcasts/samedi-fiction/concert-fiction-dracula-de-bram-stoker-1194362,Français,26/6/2014,,https://www.radiofrance.fr/franceculture/podcasts/samedi-fiction/concert-fiction-dracula-de-bram-stoker-1194362,,,,,,,,,,,,,"Stéphane Michaka, France Culture"
Dragon’s Flair,dragon-flair.jpg (https://v5.airtableusercontent.com/v1/18/18/1689292800000/_Fi--m7Nis0VzRhB5oAvBQ/s3uvFwymisgs5qYVjXShQ9h9oeTh3A-PbeNWat1gn51wRMmAgIlWT6I4Jqpb0AG-OuP8GQJIihE-3ohH4i0AkURwxZjVCQ_cKuHaWWMUaO4/LPPsMXvv6JHmTg-jkEy1UDCG8hak7d4puo5xN-cNjF8),Terminé,Horine,Fantasy,0:29,29 min,"Vanihallia est un monde où la magie y est utilisée au quotidien dans les tâches de la vie courante. Sauf pour quelques personnes qui la pratiquent pour vivre ; ils sont appelés tout naturellement des Mages. Ces Mages se regroupent dans des guildes et effectuent diverses missions, comme mercenaire. Mais cette histoire se concentre sur le petit groupe d’une guilde qui se nomme « Dragon’s Flair ».",,https://podcloud.fr/podcast/dragonsflair,Français,,checked,https://aylion.fr/lecheminhorine/fictionsaudio/dragonsflair/,https://www.youtube.com/watch?v=H451UOGI5NQ&list=PLEwFqEEltwREoKwUyqXdtKVMij82TEQFa,https://dragonsflair.lepodcast.fr/rss,,,,,,,,,,,Horine
Duke Niké,duke.jpg (https://v5.airtableusercontent.com/v1/18/18/1689292800000/Xysxa5NMeZWlqixSqxkz-g/gu73olHjYgjpK3yXXO4a0i0zHMKVH7Syk8Cn6JBeK8MEb7zfPidj54bi5YijzUsu3CZGU1VparcnNZbwfPWERg/cTQ2vEXDC-BUKlgcvVu1iSkZ7Luo7zNo4yBrGXhg9M8),Terminé,Aslag,"Humour,Licence",2:11,2 h 11 min,"Duke Niké et son meilleur ami Dan Johnson reprennent du service lorsque la Terre est pour la énième fois attaquée par des aliens. Cependant, cette fois-ci, les extraterrestres s'attaquent à notre époque en modifiant notre passé. Seul argument pour Duke de s'occuper de tout ceci : sa moto a été changée en tricycle. Il va y avoir des séquelles !!",,https://duketotchi.lepodcast.fr/,Français,,,https://www.facebook.com/duketotchi/posts/1374437132577884,,http://duketotchi.lepodcast.fr/rss,,,,,,20,,,,,Aslag
Dune pour les Nuls,dune.jpg (https://v5.airtableusercontent.com/v1/18/18/1689292800000/ToPvjN543IOehYLoX_8UVQ/DnF5RSyko6N8nNqQj8iIagwJrZshsAztETNl775PiCo--UI3L7IrPFuXFlWFg24J3qEmd9RGzF4rImBIo4SXpQ/2xJNspoceWANuAruQeMhyrfmhtQfP_HLSfzGZ1cQGmA),Terminé,Leto75,"Science-Fiction,Parodie,Licence",,Non définie,"C’est une période de conspiration. L’infâme Empereur Shadam IV redoute que la nouvelle armée entraînée par le Duc Leto Atreides ne surpasse les capacités de ses propres Sardaukars, les Soldats de la Peur. Décidé à éliminer ce potentiel rival, l’Empereur met en place une terrible machination avec le concours de la vile Maison des Harkonnens. Les Atreides se verront remettre la désertique planète ARRAKIS en fief prenant ainsi la place que les Harkonnens occupaient depuis 80 ans. Ce que le Duc ne sait pas, c’est que les Harkonnens planifient une attaque de grande envergure, avec l’aide de l’Empereur et de la Guilde Spatiale. Le piège est sur le point de se refermer sur la Maison des Atréides. ",,https://dune-pour-les-nuls.lepodcast.fr/,Français,,,https://freganletohic.wixsite.com/dune,,https://dune-pour-les-nuls.lepodcast.fr/rss,https://soundcloud.com/fregan-stinson-le-tohic/sets/dune-pour-les-nuls,,,,,,,,,,Leto75
ECHOS,echos.jpg (https://v5.airtableusercontent.com/v1/18/18/1689292800000/OFNKchtwAEG5ND7wFNTBkw/vFil2YcaQ8RzN1bacAuIy8ndBmiivwNgtOTNFVzxbCCG7-HGrX5PUQKNGPeIyQNw9dL0iZugOWt1CdDIzn39bI-i3mE5qn7DjWQoTcT0KjI/tJLgRMXV2ECjI1HyG8zOS3FquCLYMwr_ile4PaZNahc),Terminé,Le Sam,"Musical,Tranche-de-vie",0:56,56 min,"« L’histoire au service de la musique, la musique au service de l’histoire » voilà la définition de ECHOS. Dans ses univers singuliers, la série nous raconte les histoires de nombreux personnages et lieux. Du petit club de Jazz de TOO FAR TWO JAZZ au studio lugubre de SEVEN RADIO les nombreux décors et situations s’enchaînent au travers de 8 épisodes. ",,https://www.youtube.com/watch?v=kjAO_QhgcmU&list=PL2_6NWjFJ82JvYbr6H0nQF_T9o12WiiKl,Français,3/12/2022,,https://www.youtube.com/watch?v=kjAO_QhgcmU&list=PL2_6NWjFJ82JvYbr6H0nQF_T9o12WiiKl,https://www.youtube.com/watch?v=kjAO_QhgcmU&list=PL2_6NWjFJ82JvYbr6H0nQF_T9o12WiiKl,https://anchor.fm/s/d26e3764/podcast/rss,,,,,,Zeni1,,,1. À écouter,,Le Sam
Eden,eden.jpg (https://v5.airtableusercontent.com/v1/18/18/1689292800000/2IbZlq-YDpl75Kw7NMuXkA/Hmyn2g4zinKRSwFQxSNk4T4zOfTh8fMuoGfppuMQMbIqYEb0Vuqa42pinMsqEwD3IWnsB_SY3LUnCWJTDTduvw/8EvJYDDdXdJh9TjPYlS-qm6sN24CRjpIh3RbAh5VNz0),Terminé,"Antoine Rouaud,Audiodramax",Science-Fiction,11:20,11 h 20 min,"Véritable voyage à travers l’espace et le temps, EDEN reprend les clichés du Space Opera pour mieux se les réapproprier. EDEN suit le parcours d’une jeune étudiante se réveillant après 8000 ans de cryogénisation dans un univers où l’humanité n’a plus sa place. Batailles spatiales, extraterrestres en tout genre et fuite éperdue à travers le temps et l’espace…",,https://www.audiodramax.com/eden/,Français,,checked,https://www.audiodramax.com/eden/,,www.audiodramax.com/tag/eden/feed,,,,,,20,,,,,"Antoine Rouaud, Audiodramax"
Eden Sacrifice,eden-sacrifice.jpg (https://v5.airtableusercontent.com/v1/18/18/1689292800000/7RL2GBV8lH08wPmiZHRN6g/rJYM685kgt3SJ2xp3UFEX8ESyYSTtPmw-wVCeGoTU5FqV03hVaoCOU4sZykVM9bHcDBNznOqvC0zf_TrILZS-pUulujgBptCCXPs3X7_9R0/oQiSeMlvKR74_2wfkjKzbqn6YZsNQM6qbvAsUrami8c),Terminé,"Antoine Rouaud,Audiodramax",Science-Fiction,1:50,1 h 50 min,"Dans une galaxie en reconstruction, le capitaine Délisse, dernier homme vivant, survit en tant que convoyeur. Sur Seyten, une nouvelle mission lui est confiée par le grand Omgaa, caïd local. Amener des armes sur la planète Anef… Mais une jeune Néfil décide de s’inviter à bord du Belbeth System. Pour une raison bien particulière : sauver le capitaine d’un danger proche.",,http://www.audiodramax.com/eden-sacrifice/,Français,,checked,http://www.audiodramax.com/eden-sacrifice/,,http://www.audiodramax.com/tag/eden/feed,,,,,,,,,,,"Antoine Rouaud, Audiodramax"
El Kapoutchi,kapoutchi.jpg (https://v5.airtableusercontent.com/v1/18/18/1689292800000/gJFBSfsTw03110oK3Jsf9w/e_iBcUHVH4KvZSeLIkuGLjEKVZUNoqTz9xaBydtm3-k0Z1god_mRBjGsTXV6iPKoZWhRVehUGlad8WvovDMAALYOfapFnjUj5rYDIp6WY_o/lAOFc43__ehEIwErAK9dRjzNarWffYbb-NafKBO2kUs),En cours,"Alexandre Courteau,Pascale Richard,Sébastien Heppell",Enfant,,Non définie,"Entrez dans l'univers fantasque d'El Kapoutchi, le roi des méchants, prêt à tout pour embêter les enfants. Des histoires conçues pour les petites oreilles (de 6-9 ans), mais qui sauront satisfaire les plus grandes aussi. Découvrez de nouvelles aventures chaque mois.",,https://ici.radio-canada.ca/ohdio/balados/4815/elkapoutchi,Français,,,https://ici.radio-canada.ca/ohdio/balados/4815/elkapoutchi,,,,,,,,,,,,,"Alexandre Courteau, Pascale Richard, Sébastien Heppell"
Empoisonnées,empoisonnees.jpg (https://v5.airtableusercontent.com/v1/18/18/1689292800000/EcslDky_fFCUh7LbWOJZOQ/ki6omuzPzUQgZO9-HQaa-WH0rMstkRKM0_kob28saspu4ypqbpElB2fjWgDYr5hMKmSNTsM9nxfZ547zL5NsygmwmpbP_vDFCVIeWq-vm_8/n-BY87ET5w2OwUkfiwcR0siPEcSl3gM76s_JMcPJdxs),Terminé,Charly Lemega,Policier,2:13,2 h 13 min,"Au milieu des années 2000, le département de l’Essonne est le cadre de mystérieuses disparitions. Celles de nombreuses lycéennes, a priori sans lien entre elles, si ce n’est cette troublante coïncidence : juste avant de disparaître, toutes ont été prises de vomissements et d’étranges symptômes inexpliqués. Deux amis d’enfance décident aujourd’hui de mener l’enquête sur ce phénomène qui a marqué leur scolarité. Entre investigation, archives et témoignages, leurs recherches vont les mener bien plus loin qu’ils ne l’avaient imaginé…",5,https://www.empoisonnees.fr/,Français,,checked,https://www.empoisonnees.fr/,https://www.youtube.com/playlist?list=PLHZmELvt6DerJDiwhfjPVz-v8S4TuvGgh,https://anchor.fm/s/2fd43b70/podcast/rss,https://soundcloud.com/charly-lemega-738149255/sets/empoisonnees,https://open.spotify.com/show/31bY3vSXduIiJPs1fRt1DU?si=2eybQxMxTT-A8sgzx_HcAQ&nd=1,,,,,https://anchor.fm/s/2fd43b70/podcast/play/27894732/https%3A%2F%2Fd3ctxlq1ktw2nl.cloudfront.net%2Fstaging%2F2021-2-4%2F5ea57de1-2613-d20c-c729-2aa67c6e4cab.mp3,,,,Charly Lemega
Enchaînés,enchaines.jpg (https://v5.airtableusercontent.com/v1/18/18/1689292800000/7FvqOM8Wuamcfq_9v35yDw/OBasAsAgrvAoCTwAJgbAO2tqh7oqCy0NIe1mXXrdsiXrjUGRRTyvtgZgvOc9Y-m99Vx-PyqxnznVL1-tNTocm7825paB4UCa4J6cw4JAxH0/H0MLCgKBm_l_mUTIaZiSJ_b-rrYk8xI6bPDLGuy403U),Terminé,Thetchaff,Thriller,0:32,32 min,"Tu as cru que tu t’en tirerais comme ça ? Tu pensais que je me laisserais faire sans rien dire ? C’est hors de question. On est là, rien que toi et moi, il n’y aura personne pour interférer. Tu vas rester avec moi aussi longtemps que j’en aurai décidé. Et tu craqueras, je te le garantis. Tu luttes, mais je tiens bon. C’est moi qui l’emporterai. Tu ne m’empêcheras pas de vivre.",,https://thetchaffprod.fr/fictions-audio/enchaines/,Français,,checked,https://thetchaffprod.fr/fictions-audio/enchaines/,,,,,,,,,https://thetchaffprod.fr/wp-content/uploads/2016/10/enchaines-teaser.mp3,,,,Thetchaff
Enchères et en os,encheres.jpg (https://v5.airtableusercontent.com/v1/18/18/1689292800000/oONUeAISRyr7f8axqKpKKg/dsunLuS7B-HyodFKXw2PLLDy1Wreelp3qcS3u4MFiaVmJp3cIJoUlxMSPKZvV6VsDntXtw3eeodqBrfCRd1KOtb5KHb3W6i_NHBLAZGOTls/_Udhka3boFqlEgSXqqq9KWtxl1_8h88gZqdHyjhTd4E),Terminé,Pharzor,"Humour,Parodie",0:21,21 min,"Vous avez toujours rêvé d'une émission de télé-réalité en fiction sonore ? Non ? Bah je l'ai quand même fait ! Enchères et en os est une parodie d'émission de vente aux enchères à l'américaine : 6 candidats, 3 conteneurs et plein de surprises.",5,https://soundcloud.com/les-monos-herisound/encheres-et-en-os,Français,24/4/2022,,https://soundcloud.com/les-monos-herisound/encheres-et-en-os,https://www.youtube.com/watch?v=vCO-XTu7Hk4,,https://soundcloud.com/les-monos-herisound/encheres-et-en-os,,,,,Zeni1,,,1. À écouter,,Pharzor
Encore une histoire,encore-une-histoire.jpeg (https://v5.airtableusercontent.com/v1/18/18/1689292800000/JPz1KJ11djjJ33nUC-UIeQ/eR20xy8wWOUVvHNhwv1KzgMYkEo4AqAEiHwnEdOGsylnzmVE4NkU9xWq7Isz4LKxXszXZ_6wmIDcwDeRCN0ND7LZ0L6AHmc5XASfKMfEjHs/eiGjdEeaxYCxM7r615NgJJCBr71-194cc03Tkl7nsP0),En cours,"Céline Kallmann,Alexandre Ferreira",Enfant,,Non définie,"Encore une histoire est un podcast destiné aux enfants (et à ceux qui le sont encore dans leur tête) qui aiment qu'on leur raconte des histoires. Chaque semaine, vous retrouverez ici une histoire lue, tirée d'un livre de littérature jeunesse ou une création originale. À écouter avant de se coucher, allongé dans l'herbe, dans la voiture ou dans le train, Encore une histoire veut mettre en avant la formidable création littéraire destinée aux jeunes lecteurs (et aux moins jeunes, donc).",5,https://podcast.ausha.co/encore-une-histoire,Français,,checked,https://podcast.ausha.co/encore-une-histoire,,https://feed.ausha.co/BNXMdhnKwlOe,,https://open.spotify.com/show/6E0EyfV64HHUJvOYG2eBY5,,,,,,,,,"Céline Kallmann, Alexandre Ferreira"
Enfants d’Atlas,enfants.jpg (https://v5.airtableusercontent.com/v1/18/18/1689292800000/Wh1Q4lmgVCO2_bkA8c422A/rF0zxuhRb084zbIWyBY7rq4L3lpsCuwaV_iYRY2ZDqiou40Eq-EB76I2qNQjO0Lb53mQ9Kk1H9olB-nxNSgOltcMBgZLlu0zePQOwwgIVBw/84Tj4q5E0Z8ngdzuGaB5_RKcMHmpryMFunZNlyVw0gY),En cours,"Tamica,Oriog Créations",Policier,0:28,28 min,"Laura a grandi dans la rancœur envers son père, Charles, qui l’a abandonnée lorsqu’elle n’avait que sept ans, alors que sa mère venait de mourir. Des années plus tard, lorsqu’elle apprend sa mort, elle découvre un héritage qu’elle n’aurait jamais soupçonné. Elle se retrouve, bien malgré elle, embarquée sur les traces… tumultueuses de son père.",,https://enfants-d-atlas.lepodcast.fr/,Français,,checked,https://oriogcreations.fr/fictions/gollwyd/enfant-datlas/,https://www.youtube.com/watch?v=AI-hswnLH1g,https://enfants-d-atlas.lepodcast.fr/rss,,,,,,"TJP2019,TJP",,,,,"Tamica, Oriog Créations"
Envolées Contées,EnvoléesContées.jpg (https://v5.airtableusercontent.com/v1/18/18/1689292800000/syYgM6at-SSQ5yvazdA-bA/mi8UFZml8eIbJ-O4Cs-JAXE50l0bwbPfZPOmWLy_qqcz8oRy7HoH9VFZvdtX4cotR_tycfQoaXuwhc92Ln-PUhp_2g90MEOI6OAcZKZ6WgU/7QtYCWQDJ-nkYp621rXEb2XQe8k-F1EcOQn8FChgyuA),En cours,"Lucile Petit,Suzanne Jolys,Héloïse Pierre","Enfant,Fantasy,Fantastique",,Non définie,"Envolées Contées est un podcast né pendant le confinement pour permettre aux enfants de continuer à rêver, imaginer ou s'évader, même entre quatre murs. Au travers d'histoires sonores, se déclinant en courts épisodes, laissez vos enfants s'envoler vers d'autres contrées le temps d'un instant. Un brin féministe et écolo, Envolées Contées propose des histoires sonores destinées aux enfants de 3 à 10 ans.",,https://www.clap.audio/envoleescontees,Français,,,https://www.clap.audio/envoleescontees,,,,https://open.spotify.com/show/4JSS0HVWcI6YZkOcye9XhT,,,,,,,,,"Lucile Petit, Suzanne Jolys, Héloïse Pierre"
Erika et les princes en détresse,erika.png (https://v5.airtableusercontent.com/v1/18/18/1689292800000/FvmiaYkqzv1UB5S5rCqH3g/xY9bLQBM636GDjOoaBXJTBNO5Ra-8Rza6nzn2EE2XYeranpGvnC02o0_X_xFNLR-urYp5NkOmkwtWIq3Tft-STKBzn7sE4GoZtp-Vl6XvJM/HY9po4uf9N7nBo_rNnI6m_WoodRwb87-tWHa1N_VcY0),En cours,"Richoult,Gihellcy,Javras","Fantasy,Licence",0:43,43 min,"Erika, notre princesse, compte bien succéder à sa mère et prendre le pouvoir seule sauf que… Elle ne veut pas se marier ! Et donc, pour échapper à cette tradition on lui confie une mission : celle de sauver des princes en détresse ! Cette quête tombe à pic pour la reine qui va pouvoir s’en servir à son avantage…",5,https://javras.fr/sagas-mp3/erika-et-les-princes-en-detresse/,Français,,checked,https://javras.fr/sagas-mp3/erika-et-les-princes-en-detresse/,,https://javras.fr/feed/podcast/erika-et-les-princes-en-detresse,,https://open.spotify.com/show/4KEMhzNhmpofF4GAnmNL0h,,,?:Qui va vous aider à laver vos culottes sales ?,,,,,,"Richoult, Gihellcy, Javras"
Esprits : Au bout du village,esprits.jpeg (https://v5.airtableusercontent.com/v1/18/18/1689292800000/tNsWTqtkgJPjjnggvBY9ng/LLyqdcRkDZ0ducXb1p06X1j3hHbLCEdwrHzYeyXTbIxfLLTjyooadDEL5_3KkR_c3FdgqXPIXdTpR7QX1WviIzKSxWcFSrXxyQyDOVCuSag/yxiGFdvZmhrAUnsXhGZ5GFTz5_jtq5YKweTDVN2jHmg),Terminé,Adrien Fernandez,Enfant,,Non définie,"Découvrez l’aventure d’Émilie, une jeune fille courageuse qui se rend dans la forêt dont personne n’est jamais revenu. Les légendes locales parlent de monstre tentaculaire, mais elles sont loin, très loin de la réalité.",,https://shows.acast.com/esprits-seedsofdreams,Français,,,https://linktr.ee/esprits.io,https://www.youtube.com/channel/UCbYR7N_eCBp6Qc8jYfprstA,https://feeds.acast.com/public/shows/esprits-seedsofdreams,,https://open.spotify.com/show/30aDInGkF13snH0TkbHHp6?si=26d10d23d74b40b0&nd=1,,,,,,,,,Adrien Fernandez
Et la Terre éclata...,etLaTerreEclata.jpg (https://v5.airtableusercontent.com/v1/18/18/1689292800000/wkoTRhxfhYhAdT4SHtpK9Q/7dVjLiAkqozgy2PU0Pfk4lKq714PdJT7QyBFZnlnHu5fqU0c4a2wYvt1xF8Aqc8wLaAJ6QRlS4oLTBn8xhyrFg3HThNLbmR2cfMiFCGVDqA/A0jfN4FrDlODwn5LGTgc5MMqV0kqTJTjWmLTvOcdvdg),Terminé,"François TJP,MimiRyudo,Studio TJP","Science-Fiction,Humour",3:03,3 h 3 min,Des capsules de Science-Fiction Radiophonique qui vous racontent simplement... la Fin du Monde.,5,https://boum.studiotjp.com/,Français,,checked,https://boum.studiotjp.com/,https://www.youtube.com/playlist?list=PLR3_sTHVLKhdXrjsVMT6kw6hLCu4mBlVn,http://elte.lepodcast.fr/rss,,https://open.spotify.com/show/6QQKX8m2uHhcEss8KP1gSx,,,,Zeni1,,3. Noté,,,"François TJP, MimiRyudo, Studio TJP"
Et si Ganda s'était sauvé ?,ganda.jpg (https://v5.airtableusercontent.com/v1/18/18/1689292800000/jT9i97PXjVF8WL_MZjmifA/3yTOZV8NenWQRUz0UNxN9Jr3J6aR_r7A_6lyRQo6FOxntpr5r7kaVyMUqey_hRzE3oa5hxr9Zm7tJaZnFLvwwgLs3iH7gZbZioEcO-4Q2qg/NIGA6EM7Ip1Eb7E39YlHeAKWTXQPfP31HpylMBHgHSc),Terminé,Chloé Despax,Enfant,0:21,21 min,"Cette histoire, presque vraie, est celle de Ganda, un rhinocéros indien qui a bel et bien existé. En 1515, un sultan indien nommé Muzaffar offre au gouverneur des Indes portugaises un rhinocéros. L’animal est expédié au roi Manuel Ier qui l’offre à son tour au pape. En route vers l’Italie, Ganda fait halte sur l’île d’If, à Marseille. Prisonnier et harnaché depuis des mois, Ganda n’a qu’une seule idée en tête : s’évader.",,https://soundcloud.com/chloedespax/22-12-08-export-et-si-ganda-s-etait-sauve,Français,,,https://soundcloud.com/chloedespax/22-12-08-export-et-si-ganda-s-etait-sauve,,,https://soundcloud.com/chloedespax/22-12-08-export-et-si-ganda-s-etait-sauve,,,,,,,,,,Chloé Despax
Evil&Co,evil.jpg (https://v5.airtableusercontent.com/v1/18/18/1689292800000/1EtQ6-4Hj4vYfVmxveeUlA/muGA7s0HaAm2fx0LgCgEQOU04Kityr1liryOEPUG7UHIN8daywl7H7DQkpJ6IziZbYZYI1fQqXWTV1pEn8tQTA/G0gQDPbsv7m9PT53oz2VUW1QIaU4xbXQSd7gvxMYHGI),Terminé,"Adrien Berthalon,SoundStorm Productions","Humour,Tranche-de-vie",1:00,1 h 0 min,"« À quoi on sert ? Au début, j'en avais pas la moindre idée. Et puis j'ai entendu un jour dans le hall qu'Evil&Co devait faire monter le nombre de tampons rouges à l'entrée du purgatoire... Ça m'a fait tout drôle de savoir que j'étais utile, j'avoue. Surtout sans le faire exprès en fait ! Ah, attendez, y'a Gerard ! Ça fait 3 jours que je lui baisse son froc en criant ""escalope"", il essaye toujours de comprendre pourquoi ! »
- Tuc, employé du service ressources humaines d’Evil&Co.",,https://evilco.lepodcast.fr/,Français,,checked,https://soundstorm-productions.net/serials.php,https://www.youtube.com/watch?v=SLzo-ENmlnE&list=PLZnk_KyYWXhCfowNbDOxyEZWBuhZpKHKK,https://evilco.lepodcast.fr/rss,,,,,,,,,,,"Adrien Berthalon, SoundStorm Productions"
Exobiologie et Exocivilisation Virginienne,exobiologie.jpg (https://v5.airtableusercontent.com/v1/18/18/1689292800000/xdnDnhfSjrkJukGe8h-YTQ/0p9EjKd31XoqDtgNv11Oekk6aiuVrNb39odytqYwG13kFkD630Ad4B_bul7KKK3p1cprmQsx568kI3gRmO6bb_V1E3CsiQZiK8IdVuxeJaI/HDA6-W5DoPBlKm2SGOrllGDLndMW1MEiojoc5rogUbI),Terminé,François Courtis,Science-Fiction,2:36,2 h 36 min,"Le 12 mai 2017 l'Humanité recevait le message d’une civilisation extraterrestre localisée dans le système planétaire de Proxima Virginis. Plus de 25 ans après la réception de ce message, il convient de faire le bilan : que sait-on de l'exocivilisation virginienne sur le plan biologique et sociétale ? Pour répondre à ces questions, avec l'Université Polytechnique Lyon - St Étienne, nous vous invitons à vous inscrire au cours Exobiologie et exocivilisation virginienne.",5,https://anchor.fm/francois-courtis/episodes/Bande-annonce-du-cours-eei9od,Français,,checked,https://anchor.fm/francois-courtis/episodes/Bande-annonce-du-cours-eei9od,,https://anchor.fm/s/20b98a00/podcast/rss,,https://open.spotify.com/show/2k7s06OUA1uinQ6XuI1dYL,,,,,https://d3ctxlq1ktw2nl.cloudfront.net/production/2020-4-25/76576035-48000-2-8886897737096.mp3,,,,François Courtis
Exosoma,exosoma.jpg (https://v5.airtableusercontent.com/v1/18/18/1689292800000/xUWAPJBa2s1GTGjbJz4KWg/cJbfHN3nX6H1z6Nw1Cc0t4SGDyqmWZmsAAF-YpS-SEKj6nBKEOAYd_G8yeSG827xWMfIhgqxldJryP29INK5DrAVke5UWhk0PVtEiPMUUao/o-YsXtRtbXc2ZE3N0jE5VcpaInfHiHzWxu58has7v00),En cours,Fullnegi,Science-Fiction,,Non définie,"Nadge Canem, chasseur de prime et tête brûlée, essaye de s'enfuir de l'Estia, croiseur de commandement de la flotte Stultus. Pendant ce temps, Dolossa, un type chargé de l'entretien sur un autre bâtiment, perçoit par hasard l'enregistrement de Nadge, qui a un mouchard sur lui. Il va essayer de se faufiler pour aller sauver notre premier héros. À deux, ils vont devoir s'échapper de l'emprise du « maître », découvrir les projets des Stultus et revivre leur passé.",,https://fullnegi.wixsite.com/univers,Français,,,https://fullnegi.wixsite.com/univers,,,https://soundcloud.com/fullnegi-francois/sets/episodes,,,,,,,,,,Fullnegi
Exquises Fictions,exquises.jpeg (https://v5.airtableusercontent.com/v1/18/18/1689292800000/eLcDqpYdf8cN4NCC0XhQ4g/P1yq5SaPntAMzoogUPGBFEWl6pvtb0JueRntxxfCdzSa26bpw2LAqjeOARa55ZqNR5KxjYkBRvLbWO5W-zqoq5FQnPbkvOC4zCV6lQVa1wE/okJuFCa1UiiKpVgwfoxcc8TDfFme2vyNKyvdbo037xE),En cours,David Geiger,Science-Fiction,,Non définie,"Le cadavre exquis, vous connaissez ? Mais le podcast exquis, ça, vous ne devez pas connaitre. Quelqu'un crée une histoire et la raconte à la façon d'un livre audio. Une autre personne écrit la suite et la raconte de la même façon. Qu'arrivera-t-il à la fin de la saison ? Vous le saurez en écoutant ""Exquises Fictions"".",,https://podcast.ausha.co/ExquisesFictions,Français,,checked,https://www.plopcast.fr/les-emissions/exquises-fictions/,,https://feed.ausha.co/mb5d4Sglw1Dy,,https://open.spotify.com/show/5xiaq0EBaE6aciz30FxLpt,,,,"TJP2019,TJP",,,,,David Geiger
"Fantômas, le génie du crime",fantomas1.jpg (https://v5.airtableusercontent.com/v1/18/18/1689292800000/y6Ckhf6wIl1xoMIab-C8OA/kqmJUYqPEunngQYZdtuB1o8HcS6Wvx8WCakYRaqL3r3dHiRKLFN0N2UIMEbYhHYPJsGJW6SQiSIR9kvd0iPMBG5w0-JUwE5CqrHKL1TdnfM/AWILevHNyaU2go9SWmC_Tv4ocEmk10w0rXz-8_CourU),Terminé,"Jean-Matthieu Zahnd,Xavier Maumejean,France Culture",Policier,0:59,59 min,"Tout accuse Jérôme Fandor, jeune journaliste enthousiaste à La Capitale. La jolie Hélène est bouleversée,  le juge Bonnet fait appel à l’inspecteur Juve. Pour le plus grand policier de France, le meurtre est l’œuvre d’un esthète, d’un artiste du crime. Tout comme l’assassinat de lord Beltham évoque  le style de celui qui tient Paris dans les chaînes. Des troquets pour Apaches aux immeubles de Neuilly, nul n’ose en parler à voix haute, y compris lady Beltham, sa splendide maîtresse. Le Prince de l’Épouvante est disposé à défier la guillotine afin que la foule scande son nom : Fantômas !",5,https://www.franceculture.fr/emissions/fictions-samedi-noir/fantomas-le-genie-du-crime-de-pierre-souvestre-et-marcel-allain,Français,,checked,https://www.franceculture.fr/emissions/fictions-samedi-noir/fantomas-le-genie-du-crime-de-pierre-souvestre-et-marcel-allain,,,,,,,,,,,,,"Jean-Matthieu Zahnd, Xavier Maumejean, France Culture"
Ferme les yeux et regarde,ferme.jpg (https://v5.airtableusercontent.com/v1/18/18/1689292800000/m0-R6H4_aDQCQuFKJCwt1g/J9eXhCIRTXmJJiuXlIhNvU7fO-b7SEYG8THHlOSnWEqXwZAkY16QUPG4xNI644cSib_XHPwdTF_f1hGRPjpj3szKO9H9JbePzlG0mekXD-Y/yLKpg79mx6n3aSxTMDhgADtXtkgVLD-pY14876ppRqM),Terminé,"Jérémie Nicolas,Élodie Parmentier,Mathilde Anquez",Tranche-de-vie,,Non définie,"Et si on imaginait des histoires à partir de grands chefs-d’œuvre ? Et si les œuvres prenaient vie par le son ? Comme si nous, humains, avions la faculté de nous transporter dans les tableaux ?",5,https://open.spotify.com/show/7EA1E13zjQuLEjCnBeZf63,Français,,,https://open.spotify.com/show/7EA1E13zjQuLEjCnBeZf63,,,,https://open.spotify.com/show/7EA1E13zjQuLEjCnBeZf63,,,,,,,,,"Jérémie Nicolas, Élodie Parmentier, Mathilde Anquez"
Fin de citation,citation.jpg (https://v5.airtableusercontent.com/v1/18/18/1689292800000/JsQP-s4RiC6O3bUdyUsGrQ/fyCxzdPHt9XgsJ9ZIQ67xbiDu92VoZkzWPRXBjxiW_OBemyl5F8vFxYEdr6PEjc4V-vOaEEv6N0CRSRcf6VvLKjt6VaXj2-P2jO4nHizt4E/-vtu5sqfQTFjlqNacQrxBwzGjWjii_-1aDDX13IK_J4),Terminé,"Alexandre Choiselat,Thomas Adda,Sodasound","Policier,Musical",0:57,57 min,"« Avec un grand verre de lait et un petit sombrero » est la première saison d’une série musicale dont chaque chanson constitue un épisode. Ces morceaux mis bout à bout vous permettront de reconstituer le puzzle de ce polar moderne. On y suit 6 personnages hauts en couleurs dans une aventure urbaine rocambolesque. D'un côté Didier Chadot, K-Nif, Guilty Fixer, 3 musiciens vivant dans la marge et cherchant une solution rapide pour financer leur premier album. De l'autre, Ange Marsulacci petit truand médiocre œuvrant dans l'ombre de son père, et son lieutenant Street Credibility, jeune femme à la violence assumée. Deux univers opposés qui vont se percuter de plein fouet.",5,https://podcloud.fr/podcast/fin-de-citation,Français,12/7/2021,checked,https://www.findecitation.com/,,https://fin-de-citation.lepodcast.fr/rss,,,,,,"TJP2021,TJP,Zeni1",,3. Noté,,,"Alexandre Choiselat, Thomas Adda, Sodasound"
