Nom,Pochette,Statut,Auteur,Genre,Durée,Somme,Synopsis,Note,Site,Langue,MP3,Website,Youtube,RSS,Soundcloud,Spotify,Discord,Récompense,Citation,Recommandation,Bande-annonce,NSI 2022,Message Insta,Auteurs
Les Odyssées,odyssees.png (https://dl.airtable.com/.attachments/a5b86d463e50d7d2966bdb558dd924b6/7651aff5/odyssees.png),En cours,"Hélène Bizieaux,Laure Grandbesançon",Enfant,,0:00,"C'est au travers de 60 épisodes que vous pourrez vivre la découverte des États-Unis, la révolution Française, la chute du dernier empereur chinois, les fouilles de la grande vallée des rois en Égypte, la folle énigme du masque de fer, les aventures de deux femmes pirates, le récit d'un roi légendaire, le pouvoir de la reine Aliénor d'Aquitaine, etc.",,https://www.franceinter.fr/emissions/les-odyssees,Français,checked,https://www.franceinter.fr/emissions/les-odyssees,,,,,,,,,,,,"Hélène Bizieaux, Laure Grandbesançon"
Les P'tites Histoires de Taleming,taleming.jpg (https://dl.airtable.com/.attachments/80b896d3d5fe9350ebb55fce05137c7c/7a939661/taleming.jpg),En cours,Mathieu Genelle,Enfant,,0:00,Des histoires audio qui font grandir les enfants et stimulent leur imagination.,5,https://taleming.com/,Français,checked,https://taleming.com/,,https://rss.acast.com/les-ptites-histoires,,https://open.spotify.com/show/2hLDC6e3HNIQqwkrQCOsZy,,,,,,,,Mathieu Genelle
Les podcasts d'Auden,auden.jpeg (https://dl.airtable.com/.attachments/8bd5a66c42217c48873882021a885277/4cb4a201/auden.jpeg),En cours,Auden Nicolas,Enfant,,0:00,"« Arrêtez les écrans, lisez des livres et écoutez les podcasts d'Auden. » Des petites histoires racontées par un garçon de 5 ans passionné de livres ! surtout pas pour les adultes ! À écouter sans modération à tout moment de la journée ou juste avant de se coucher...",,https://podcast.ausha.co/les-podcasts-d-auden,Français,checked,https://podcast.ausha.co/les-podcasts-d-auden,,,https://soundcloud.com/audenpodcasts,,,,,,,,,Auden Nicolas
Les podcasts de Rocky,rocky.jpg (https://dl.airtable.com/.attachments/aad869eda168b809a26903d6fb8871f1/99dfe0de/rocky.jpg),Terminé,RTBF,Enfant,,0:00,"En panne d’inspiration ? La fatigue qui s’installe ? Marre des histoires de T’choupi ? En voiture, au goûter, ou avant d’aller dormir, Rocky emmène vos enfants dans des histoires drôles, savoureuses, et rocambolesques. La RTBF présente, pour la délivrance des parents et le bonheur de vos enfants : Les podcasts de Rocky !  ",,https://www.rtbf.be/auvio/emissions/detail_les-podcasts-de-rocky?id=16653,Français,,https://www.rtbf.be/auvio/emissions/detail_les-podcasts-de-rocky?id=16653,https://www.youtube.com/watch?v=-IiwhQCGkZY,,,,,,,,,,,RTBF
Les porteurs du Ragnarök,ragnarok.jpeg (https://dl.airtable.com/.attachments/7fa6215b4616ca9978c2f22c8f7e6feb/0791fbd3/ragnarok.jpeg),En cours,Le maître du jeu,Fantasy,,0:00,"Venez écouter la légende d’un groupe de héros hors normes. Venez découvrir leurs aventures et leur histoire, à travers un monde fantastique et magique. Entre légendes Arthuriennes, mythologie Celtique et panthéon Nordique. Découvrez un monde en guerre et voyagez aux quatre coins de cette terre. Une histoire inspirée d’un jeu vidéo et tirée d’une partie de jeu de rôle entre amis. Une épopée vivante, toujours en cours dans ce monde imaginaire.",,https://podcast.ausha.co/les-porteurs-du-ragnaroek,Français,checked,https://podcast.ausha.co/les-porteurs-du-ragnaroek,,https://feed.ausha.co/omWKRf0px9OV,,https://open.spotify.com/show/3PEd3aEKtNWqcvJn4HvL6y,,,,,,,,Le maître du jeu
Les Pourfendeurs,les-pourfendeurs.jpg (https://dl.airtable.com/.attachments/88277b81ab34ab3a10a81bd77b40e570/e3805183/les-pourfendeurs.jpg),En cours,"Fal,François TJP,Studio TJP","Humour,Fantasy,Musical",2:04,0:00,"Cette fiction ""tarantino-fantasy"" suit les aventures (musicales) de deux frères pourfendeurs, Jacob & Wilhelm.",5,https://pourfendeurs.studiotjp.com/,Français,checked,https://pourfendeurs.studiotjp.com/,https://www.youtube.com/watch?v=hDRRd9ujWBk,http://lespourfendeurs.lepodcast.fr/rss,,,,Nuit Sans Image,,"Pour découvrir le genre,Zeni1",,,,"Fal, François TJP, Studio TJP"
Les sales histoires de Félicien Moutarde,felicien.jpg (https://dl.airtable.com/.attachments/d361395d5533350ea8bef1ff6dccdf71/7a46ebf7/felicien.jpg),Terminé,"François Christophe,Fabrice Melquiot ","Enfant,Humour",0:30,0:00,"Tous les laids ont leur charme. Tous les beaux sont un peu moches. Les vilains sont parfois ravissants. Les jolis peuvent être tellement tartes. Félicien Moutarde, c’est encore autre chose. De son père Michel et de sa mère Mireille, Félicien Moutarde a hérité tous les défauts de la terre. En tout cas, c’est ce qu’il affirme. Lui qui dit ce qu’il pense et ne mâche pas ses pensées. Félicien Moutarde a des supers points faibles, mais Félicien Moutarde ne craint pas la solitude. Félicien Moutarde ne recule pas devant l’amour de Première-Fois-Qui-Pique, mais Félicien Moutarde n’aime pas Croc-Blanc ni Bambi. Félicien Moutarde est extrêmement critique à l’égard du monde et de notre époque. Félicien Moutarde est né de la dernière pluie, mais franchement ça ne se voit pas. Félicien Moutarde, c’est pas de la tarte. Il pourrait devenir votre pire cauchemar et votre meilleur ami. Bref, Félicien Moutarde est un enfant hors du commun.",5,https://www.franceculture.fr/emissions/fictions-enfantines/les-sales-histoires-de-felicien-moutarde-de-fabrice-melquiot,Français,checked,https://www.franceculture.fr/emissions/fictions-enfantines/les-sales-histoires-de-felicien-moutarde-de-fabrice-melquiot,,,,,,,,,,,,"François Christophe, Fabrice Melquiot "
Les tours de l'État unique,etat-unique.jpg (https://dl.airtable.com/.attachments/8f89fae10a68e7ab27326b4880d15097/c5f5ca11/etat-unique.jpg),Terminé,Crall,"Science-Fiction,Post-apo",0:55,0:00,"3050, la Terre est recouverte par les océans et 3 tours hébergent le reste de la population mondiale en un État Unique. Jarod, collecteur des reliques du passé enfouies au fond des océans, est victime d’un accident de plongée causé par un séisme. À son réveil à l’infirmerie, on lui demande de taire le risque d’effondrement qui menace le dernier bastion. ",,https://soundcloud.com/crall/sets/les-tours-de-letat-unique,Français,checked,,,,https://soundcloud.com/crall/sets/les-tours-de-letat-unique,,,,,TJP2021,,,,Crall
Les Traqués ,20210826_123722.jpg (https://dl.airtable.com/.attachments/58de9258fa34415d144d300b97132347/6e7456eb/20210826_123722.jpg),Terminé,Pharzor,"Humour,Ambiance,Thriller",0:10,0:00,Un tueur à gages des plus sadiques chargé d'éliminer un de ses concurrents prend un malin plaisir à lui laisser des messages au fur et à mesure de sa traque. Une prise de confiance qui pourrait bien lui faire défaut dans sa quête. ,,http://www.pharzor.fr/lesTraques/serie-entiere,Français,checked,http://www.pharzor.fr/les-traques,https://www.youtube.com/watch?v=Eni57drtPds&list=PLvseIE-VmLSNhnKDLZwovHcrliEn3LOTK,,,,,,,,,,,Pharzor
LIEN,lien.png (https://dl.airtable.com/.attachments/7b508c66c7e79c9b60cb2ac93d374dd2/f4a93a07/lien.png),Terminé,La m usé,Fantastique,0:40,0:00,"Tout commence par une bande son, sans voix. Les voix apporteront ensuite, chacune en leur temps, du lien.",5,https://2020.sagadelete.fr/saga/lien,Français,checked,https://2020.sagadelete.fr/saga/lien,,,,,,,,,,,,La m usé
Lumière Noire,lumiere-noire.jpg (https://dl.airtable.com/.attachments/adeabc8656223d3f95e78ca7aee43975/ae30cc15/lumiere-noire.jpg),Terminé,Mehdi B.,"Post-apo,Science-Fiction,Policier",1:48,0:00,"Dans un futur proche, une radio pirate diffuse chaque soir une émission clandestine. Jusqu’au jour où d’étranges lumières apparaissent dans le ciel...",5,https://soundcloud.com/user-118729726/sets/lumiere-noire,Français,checked,https://soundcloud.com/user-118729726/sets/lumiere-noire,,,https://soundcloud.com/user-118729726/sets/lumiere-noire,,,,,TJP2020,,,,Mehdi B.
Ma langue au chat,Ma-Langue-Au-Chat.png (https://dl.airtable.com/.attachments/beb00d4c648f979372ab88d3fab9a526/ac5440a6/Ma-Langue-Au-Chat.png),En cours,Clémentine du Pontavice,Enfant,,0:00,"Qu’est-ce que c’est la démocratie ? Et Internet ? Et le consentement c’est quoi ? Tous les jours, des grands mots traversent le quotidien des enfants. Mais qui dit grand ne dit pas forcément hors de portée ! Dans le podcast Ma langue au chat, Gaby et son ami Chat réfléchissent et explorent ensemble pour mieux comprendre le monde qui les entoure. Ma langue au chat ce sont des épisodes de 5 minutes, destinés aux enfants de 6 à 9 ans, pour apprendre à se poser tout plein de questions sur la société d’aujourd’hui et à y trouver des réponses, en rire et en musique !",,https://nouvellesecoutes.fr/podcast/ma-langue-au-chat/,Français,checked,https://nouvellesecoutes.fr/podcast/ma-langue-au-chat/,,https://rss.art19.com/petit-ne,https://soundcloud.com/nouvelles-ecoutes/ma-langue-au-chat-bande-annonce,https://open.spotify.com/show/3Ti1AQDVEHbK1Nz8NV2Uhf,,,,,,,,Clémentine du Pontavice
Macrales,macrales.jpg (https://dl.airtable.com/.attachments/5241b86fc79cd3eb8fff70d04731c9cb/d7dd094f/macrales.jpg),Terminé,Caroline Prévinaire,"Enfant,Fantastique",0:59,0:00,"Suzy, Dries et Émilie ne se connaissent pas, mais ils vont devoir se serrer les coudes pour survivre à ces 5 nuits au mystérieux camp des légendes...",,https://lvdt-studio.com/macrales-2/,Français,,https://lvdt-studio.com/macrales-2/,,https://feeds.captivate.fm/macrales/,,https://open.spotify.com/show/2CoigUW4tgUC4n3pcghawB?si=15d4a12f4e0848b8,,,,TJP2022,,,,Caroline Prévinaire
Madame,madame.jpg (https://dl.airtable.com/.attachments/8c288ebc783941bb7d2b5a50832cdb4c/87c558dc/madame.jpg),Terminé,RTBF,"Historique,Humour",1:30,0:00,"5 autrices belges s’emparent du destin de 5 princesses belges dont le destin n’a rien d’un conte de fée.  Laurence Bibot, Victoire de Changy, Ariane Le Fort, Myriam Leroy et Isabelle Wéry prêtent leurs regards et leurs voix à ces femmes mortes folles, ruinées, tristes, ou oubliées. Madame est un podcast de fiction de La Première librement inspiré d’histoires vraies, qui fait parler les tableaux et secoue la naphtaline.",,https://www.rtbf.be/auvio/emissions/detail_madame?id=18086,Français,,https://www.rtbf.be/auvio/emissions/detail_madame?id=18086,,,,,,,,,,,,RTBF
"Maman, y a une momie !",momie.png (https://dl.airtable.com/.attachments/578e08fe7fa647d3c3f9dc7ccc502d0c/31df121f/momie.png),Terminé,"Adelyx,Javras",Enfant,0:11,0:00,"Camille et Josselin sont au musée avec leur mère et écoutent une histoire d’horreur, où un archéologue découvre le tombeau d’une famille de momies. Le lendemain, jour d’Halloween, la maman des deux enfants part travailler, et un personnage entièrement recouvert de bandelettes toque à la porte. Camille et Josselin sont terrifiés. Est-ce la malédiction des pharaons ?",5,https://javras.fr/2021/10/31/maman-y-a-une-momie/,Français,checked,https://javras.fr/2021/10/31/maman-y-a-une-momie/,https://www.youtube.com/watch?v=pgl1SqEQN3s,,,,,,,,,3. Noté,,"Adelyx, Javras"
Maxime dans sa tête,nocover.png (https://dl.airtable.com/.attachments/075ae80ec87ffb63b2abd2d1b25d96ef/763ba75b/nocover.png),Terminé,Philippe Barrière,"Enfant,Humour",0:28,0:00,"Cette histoire commence le jour de l’arrivée de Maxime dans sa nouvelle école. À la récréation, il assiste à un drôle de jeu : Boris, un élève de sa classe à la langue bien pendue, se met les yeux à l’envers et décrit à des camarades toutes les pensées qu’il peut voir « dans sa tête ». Il est aussitôt imité par ses fidèles supporters. Et très vite par Maxime, qui essaie lui aussi… Mais c’est la catastrophe : il ne voit rien ! Boris en tire un jugement sans appel : Maxime n’a rien dans la tête…",5,https://www.franceculture.fr/emissions/fictions-enfantines/maxime-dans-sa-tete-de-philippe-barriere,Français,checked,https://www.franceculture.fr/emissions/fictions-enfantines/maxime-dans-sa-tete-de-philippe-barriere,,,,,,,,,,,,Philippe Barrière
Meeple Aventure,meeple.png (https://dl.airtable.com/.attachments/8265b137930c2d6a6797cb8942c9b818/d0e0844d/meeple.png),Terminé,Proxi-Jeux,Fantasy,1:45,0:00,"Dans Meeple Aventure, Bleu et Rouge, deux meeples en mal d’aventures, décident de quitter leur boîte pour explorer l’univers ludique.",,https://podcast.proxi-jeux.fr/category/emissions/meeple-aventure/,Français,checked,https://podcast.proxi-jeux.fr/category/emissions/meeple-aventure/,,,,,,,,,,,,Proxi-Jeux
Mental FM,mental.jpg (https://dl.airtable.com/.attachments/c764c3029fb49609eb64616d4acd6d48/57f0301b/mental.jpg),Terminé,Victoire Tuaillon,Tranche-de-vie,0:14,0:00,"Une femme se plante un micro dans le cerveau. Dans sa tête comme dans la nôtre, il y a mille radios branchées en permanence : doutes, angoisses, jugements, désirs, appétits, procrastination... Bienvenue sur Mental FM, la fréquence des voix dans nos têtes.",,https://www.arteradio.com/son/61660364/mental_fm,Français,checked,https://www.arteradio.com/son/61660364/mental_fm,,,,,,,,TJP2019,,,,Victoire Tuaillon
Mes 14 ans,14ans.jpg (https://dl.airtable.com/.attachments/6fb43f6a0e4a72b6d722602a5865c37a/4c01ac08/14ans.jpg),Terminé,"Lucie Mikaélian,Paradiso",Tranche-de-vie,3:42,0:00,"Lucie a 30 ans. Au fond de sa chambre d'ado, elle retrouve le journal intime qu’elle a tenu l’année de ses 14 ans. L’année où elle a perdu sa virginité. Dans ce podcast, Lucie enquête sur les premiers pas de sa vie sexuelle, à travers un dialogue intime qu’elle noue avec l’adolescente qu’elle était au début des années 2000.",5,https://paradisomedia.io/fr/programmes,Français,checked,https://paradisomedia.io/fr/programmes,,,https://soundcloud.com/paradisopodcasts,https://open.spotify.com/show/6VdQuPdfONEWNypix9Emp1,,,,,https://sphinx.acast.com/mes-14-ans/mes14ans-bandeannonce/media.mp3,,,"Lucie Mikaélian, Paradiso"
Mes Fables de la Fontaine,fables.jpg (https://dl.airtable.com/.attachments/7dcad398678feddb4f12ce6ceb45e00f/83cd1ed9/fables.jpg),En cours,Studio KODOMO,Enfant,,0:00,"Mes Fables de la Fontaine 🐹🐭🦊🦁🐸 Venez à la découvertes de ces histoires courtes où les animaux se parlent, apprennent les uns des autres. À écouter et partager en famille.",,https://shows.acast.com/mes-fables-de-la-fontaine/episodes,Français,checked,https://studiominuit.com/podcast/29/mes-fables-de-la-fontaine,,https://feeds.acast.com/public/shows/mes-fables-de-la-fontaine,,,,,,,,,,Studio KODOMO
Mes Rêves Me Parlent,MRMP.jpg (https://dl.airtable.com/.attachments/c783d2fef04e642aebf4ef349c1cdc1a/d49a3ba7/MRMP.jpg),Terminé,icoste,Horreur,0:32,0:32,"David voudrait avoir une vie normale, il voudrait ne pas subir ces hallucinations qu'il ne comprend pas ... Une histoire inspirée par l'univers de H. P. Lovecraft.",5,https://icoste.space/#/fictions,Français,checked,https://icoste.space/#/fictions,https://www.youtube.com/playlist?list=PLRPiA_JV--XcqarEZF-E-IJRDvPJSmxuj,,,,checked,,,,,,,icoste
Milhana,milhana.jpg (https://dl.airtable.com/.attachments/cf8af7961a7465e39746dfd2d56556f2/cf5a3dac/milhana.jpg),Terminé,Zylann,"Science-Fiction,Fantasy",4:00,0:00,"Mateo est un étudiant de 18 ans comme les autres. Il fut un des plus jeunes à participer à la plus incroyable expérience de son temps : MILHANA. Créé par la Gamelife Corporation, ce monde virtuel fantastique est le premier à pouvoir immerger ses participants intégralement en son sein, telle une seconde réalité.",5,https://www.zylannprods.fr/fr/?page_id=37,Français,checked,https://milhana.webnode.fr/,https://www.youtube.com/watch?v=hmcyZOl_EVI&list=PLjhr5kxwxo9_o4q5uSVyD5qMB_dOzY55R,http://milhana.lepodcast.fr/rss,https://soundcloud.com/zylann/sets/milhana-original-soundtrack,,,,,,,,,Zylann
Mimesis,mimesis.jpg (https://dl.airtable.com/.attachments/5466765c046fe7ada6a057f3af9a4803/e6e23d05/mimesis.jpg),Terminé,Grégory Alan,Science-Fiction,2:37,0:00,"Blasé par un métier rendu presque obsolète par la technologie, un inspecteur de la crim’ rencontre enfin l’enquête qu’il n’attendait plus. L’occasion pour lui de montrer qu’il en a toujours dans le cigare, quitte à renouer avec de vieilles méthodes pas toujours orthodoxes. Mimesis, c’est une fiction sonore de Grégory Alan qui vous plonge dans un univers sonore noir et immersif.",5,https://podcast.ausha.co/mimesis-la-fiction-sonore,Français,checked,https://podcast.ausha.co/mimesis-la-fiction-sonore,,https://feed.ausha.co/oa56KTwR72r3,,https://open.spotify.com/show/3hlrP5EjhRCyS0v4tyfdUo,,,,"TJP2021,Zeni1",,3. Noté,,Grégory Alan
Minilendil,image.png (https://dl.airtable.com/.attachments/2fe07e914a593cb74ce374271035e059/ac21eb24/image.png),Terminé,Lorendil,Humour,0:27,0:00,"Patrick est un ingénieur audiovisuel qui va voir sa vie bouleversée par la mafia. La saison 2 a été co-écrite par Lorendil et, à leur insu, GeeF, LPA, Draignaell, Horine.",,https://lorendilmp3.jimdofree.com/s%C3%A9ries-audio/minilendil/,Français,checked,https://lorendilmp3.jimdofree.com/s%C3%A9ries-audio/minilendil/,https://www.youtube.com/watch?v=AeEchB8Rlzg,https://minilendil.lepodcast.fr/rss,,,,,,,,,,Lorendil
Mise à Jour,mise-a-jour.jpg (https://dl.airtable.com/.attachments/5f1b5b8ff553c146a4f84457b029935f/bc1e0799/mise-a-jour.jpg),Terminé,"Ranne Madsen,Draignaell,@now@n",Science-Fiction,0:35,0:00,"Hanako Isamu est une petite fille épanouie. Son père construit des robots androïdes. D’ailleurs, leur famille a inclus l’un d’eux, juste pour elle, chargé de veiller sur sa santé et son éducation. Il s’appelle Nathan et elle l’adore. Mais depuis quelques jours, il a l’air triste. Son père a l’air inquiet aussi d’ailleurs. Quant à sa mère, elle n’a jamais été aussi présente et angoissée. Elle n’a que 4 ans et demi, mais elle comprend bien que quelque chose de grave se passe. Mais quoi ?",5,https://2017.sagadelete.fr/saga/mise-a-jour,Français,checked,https://2017.sagadelete.fr/saga/mise-a-jour,,http://miseajour.lepodcast.fr/rss,,,,Saga de l'été,,,,,,"Ranne Madsen, Draignaell, @now@n"
Morts À l’Aveugle,morts.jpg (https://dl.airtable.com/.attachments/d2c9ed568c95c945bf912cfb36346a53/b19057e3/morts.jpg),Terminé,"Julien Aubert,Clément Gournay,Vincent L'Anthoën,Elise Costa","Western,Policier",1:35,0:00,"Las Sangres, Nouveau-Mexique. Une petite communauté religieuse vit loin de la ville. Jakob, son pasteur, a recueilli James, un cowboy devenu sédentaire suite aux meurtres de sa femme et sa fille par des indiens comanches. Une nuit, il entend le cri de terreur d’une jeune femme résonner dans son sommeil. Le lendemain on découvre le corps d’une jeune fille de la communauté au bord de la rivière. Visage tuméfié, corps brûlé et scarifié, yeux arrachés… James reconnaît la signature de ceux qui lui ont tout pris. Il pense sa soif de vengeance bientôt satisfaite. Mais l’enquête tourne au cauchemar quand une deuxième innocente est retrouvée mutilée. Pour arrêter celui qui commet ces horreurs, James devra d’abord lutter contre ses propres démons.",5,https://biggerthanfiction.com/productions/morts-a-l-aveugle-podcast/,Français,checked,https://biggerthanfiction.com/productions/morts-a-l-aveugle-podcast/,,,,,,,,TJP2020,,,,"Julien Aubert, Clément Gournay, Vincent L'Anthoën, Elise Costa"
Move In Mono,mim.jpg (https://dl.airtable.com/.attachments/f3aa64567e669e79b1d9f756da0f26c4/58337040/mim.jpg),Terminé,"Wolf,Neckhaos,Geek Forever Prod",Humour,0:14,0:00,Randy est à la recherche d'un nouvel appartement. Il trouve finalement son bonheur et tout est normal dans son nouveau logement. Et il ne s'y passe absolument rien d'étrange.,5,https://geekforeverprod.wixsite.com/geek-forever-prod/moveinmono,Français,checked,https://geekforeverprod.wixsite.com/geek-forever-prod/moveinmono,https://www.youtube.com/watch?v=kroX8nF5n2Q,,,,,,,TJP2022,,3. Noté,,"Wolf, Neckhaos, Geek Forever Prod"
MUSA-028 : Les voix de l'extinction,musa.jpg (https://dl.airtable.com/.attachments/2ec03f9724575bb63b5a75ab1f0d54b4/2b2b0297/musa.jpg),Terminé,Guillaume Reynaert,Science-Fiction,1:48,0:00,2152. La Terre se meurt et l'humanité avec elle. L'équipage de l'ISC Lynch est envoyé pour un aller simple à destination d'une galaxie inconnue.,,https://soundcloud.com/guillaume-reynaert/sets/musa-028,Français,,https://www.facebook.com/MUSA.028.fiction/,https://www.youtube.com/channel/UC8j5gnBEVHpPG3os-AxZD0g,,https://soundcloud.com/guillaume-reynaert/sets/musa-028,https://open.spotify.com/show/1EM0LrGVuSFo5OEeKSsCX8,,,,TJP2020,,,,Guillaume Reynaert
Mystères à St-Jacut,mysteres.jpeg (https://dl.airtable.com/.attachments/d54a51d7fc54f2c5c2524f7eeb71adaa/767bb05d/mysteres.jpeg),En cours,François Descraques,"Policier,Humour",15:24,0:00,"C'est un Soap mélangé à un Podcast. Un SoapCast comme on pourrait dire. Les trames sont écrites, mais elles sont découvertes en direct par les comédiens qui doivent improviser les dialogues. Et ça se passe en Bretagne.",5,https://www.youtube.com/watch?v=7bb6PrhFRzU&list=PLwplzg1cG01ug_0n8TW0oNWBokjV2FcsH,Français,,https://www.youtube.com/watch?v=7bb6PrhFRzU&list=PLwplzg1cG01ug_0n8TW0oNWBokjV2FcsH,,,https://soundcloud.com/mysteres-a-st-jacut,https://open.spotify.com/show/5Hz7SjAI4iukwb3AMuxQu1?si=6OnyRTs_RVihPbyBPqpSoA&nd=1,,,,,,,,François Descraques
Mythes & Légendes,mythes.jpg (https://dl.airtable.com/.attachments/df27668568feab9b463258f6ac3e213e/8187174d/mythes.jpg),En cours,Marc Jer,"Enfant,Historique",,0:00,"Ulysse, Athena, Thor, Anubis, le roi Arthur, et bien d'autres... Quelle Histoire te fait découvrir les mythes et légendes du monde entier, comme tu ne les as jamais entendues.",5,https://mythes-et-legendes.lepodcast.fr/,Français,checked,https://mythes-et-legendes.lepodcast.fr/,,https://mythes-et-legendes.lepodcast.fr/rss,,https://open.spotify.com/show/145gf6QoEMM5e7RxaT3Msn,,,,,,,,Marc Jer
Mythologie - Mes histoires,mythologie.png (https://dl.airtable.com/.attachments/a8cdf45e32ecca8cd51050088c366a92/1502d848/mythologie.png),En cours,"François Vermorel,Studio KODOMO",Enfant,,0:00,"🏛🌪🌎🧜🗡🇬🇷 Bonjour, je suis l’Oracle et je vais te raconter des histoires fabuleuses. Elles se déroulent en Grèce, il y a très longtemps. À cette époque, les dieux, les monstres et les héros vivent parmi les hommes. Ils s'appellent Zeus, Hercule, Ulysse, le Minotaure et il y en a encore bien d’autres ! Tu découvriras leurs aventures dans notre émission consacrée aux légendes de la Grèce ancienne dans ce Podcast “Mythologies - Mes histoires”",,https://play.acast.com/s/mythologie-mes-histoires,Français,checked,https://studiominuit.com/podcast/28/mythologie-mes-histoires,,https://feeds.acast.com/public/shows/da210259-548f-46ee-acc6-d307fa5ed542,,,,,,,,,,"François Vermorel, Studio KODOMO"
N00b,noob.jpg (https://dl.airtable.com/.attachments/70e05bd9c5c5624932aba21ce108c85c/2cdd24ba/noob.jpg),Terminé,Johana Beaussart,"Musical,Ambiance,Tranche-de-vie",0:19,0:00,"N00b se situe au carrefour de la fiction radio et de la pop expérimentale. Le récit oscille entre quotidien prosaïque et rêveries fantastiques. L’auditeur explore les fantasmes de l’auteur comme un joueur traverse les différents niveaux d’un jeu vidéo d’héroïc-fantasy. Il est embarqué, aspiré, régurgité d’un paysage à un autre, en constant aller-retour entre l’espace mental du personnage et celui de son quotidien.",,https://soundcloud.com/phonurgia-nova/johana-baussart_n00b,Français,,https://soundcloud.com/phonurgia-nova/johana-baussart_n00b,,,,,,,,,,,,Johana Beaussart
Nébuleuse,nebuleuse.jpg (https://dl.airtable.com/.attachments/32090905eb984f3b56ddc9b96f1c2884/31761fc8/nebuleuse.jpg),Terminé,SilverCherry,Science-Fiction,0:41,0:00,"Quelque part dans l'espace, deux vaisseaux ennemis s'affrontent. Mike et Murak, un homme et un homme-roche membres de la Fédération, tentent d'éloigner ce vaisseau rebelle de leur base. Soudainement, l'alerte intrusion s'enclenche : Une jeune femme blessée et paniquée s'est téléportée dans leur vaisseau et leur supplie de fuir le secteur.",5,https://nebuleuse.silvercherry.fr/,Français,checked,https://nebuleuse.silvercherry.fr/,,https://silvercherry.fr/feed/nebuleuse,,,,,,,,,,SilverCherry
Network Evil 6,network-evil-petit.jpg (https://dl.airtable.com/.attachments/173c54f771c0279fef70caa2d06283c5/f1ebc488/network-evil-petit.jpg),En cours,"Cladall,Kwaam","Licence,Post-apo",2:10,0:00,"Léon & Héléna assignés à la protection du président des États-Unis vont devoir survivre à une attaque bioterroriste qui va causer l’infection de toute une ville. Chris et Pims, membres du BSAA, luttent contre le bioterrorisme à travers le monde. Cherry est à la recherche de Jacques pour affronter le nouveau virus qui se répand dans le monde. Quant à Abba, on ne sait pas pour qui elle travaille et pourquoi elle est mêlée à tout ça.",5,http://www.wavesavengers.fr/creations-audio/network-evil-6/,Français,,http://www.wavesavengers.fr/creations-audio/network-evil-6/,https://www.youtube.com/playlist?list=PLJT6zV1wVvWypNmVYr4h5v7WkO_tRtB28,http://network-evil-6.lepodcast.fr/rss,,,,,,,,1. À écouter,,"Cladall, Kwaam"
Noises,noises.png (https://dl.airtable.com/.attachments/6bce865ada88f78b6d95a3bab40b0eab/0d7229bd/noises.png),En cours,Bababam,Tranche-de-vie,3:06,0:00,"Cette anthologie fait de l’ouïe le premier des 5 sens. Écoutez, ressentez, vibrez pour chacune de ses histoires. Plus besoin d’écrans pour vous donner de l’émotion.",5,https://play.acast.com/s/noises/,Français,checked,https://podcasts.ba-ba-bam.com/noises/,,https://rss.acast.com/noises,,,,,,"TJP2019,Zeni1",https://sphinx.acast.com/noises/trailer-les3coups/media.mp3,,,Bababam
