Nom,Pochette,Statut,Auteur,Genre,Durée,Durée d'écoute,Synopsis,Note,Site,Langue,Dernier épisode,MP3,Website,Youtube,RSS,Soundcloud,Spotify,Discord,Récompense,Citation,Recommandation,Bande-annonce,NSI 2022,NSI 2023,Message Insta,Auteurs
"""Dans la colonie pénitentiaire"" de Franz Kafka",colonie.png (https://v5.airtableusercontent.com/v1/18/18/1689292800000/ZEfs6FvTE7ZOkN5i8d-CQA/6WnwjImAOAiVbu7EZ9IqlbFnMDPQw1xTxwMFOXZ36ZXbeCM90j_YTMdlmQVrMV7PinayvBiuKsI__rvPL9PSWpxQ6wxaOklYP3oqIaopHVI/_lCfUnO_cVjvAF6gJlVBPJBXeWFVZB9e96CZfDumkjY),Terminé,"Cédric Aussir,France Culture","Historique,Fantastique",0:57,57 min,"Un expert itinérant débarque dans une île au milieu de nulle part pour examiner le système mécanique d’exécution des condamnés à mort dans une ""colonie"" dirigée par un commandant. Il est censé assister à l’exécution d’un homme au moyen d’une machine extrêmement sophistiquée.",,https://www.radiofrance.fr/franceculture/podcasts/samedi-fiction/dans-la-colonie-penitentiaire-de-franz-kafka-2685413,Français,,,https://www.radiofrance.fr/franceculture/podcasts/samedi-fiction/dans-la-colonie-penitentiaire-de-franz-kafka-2685413,,,,,,,,,,,,,"Cédric Aussir, France Culture"
"""Dark was the night"" d’Emmanuel Meirieu",dark.jpg (https://v5.airtableusercontent.com/v1/18/18/1689292800000/3A4KKtwKdk-qG-X8iG17Bw/MUzranWg6x-i0tj0YM5TvrC1EguDkU2i4unFL5ZfJKoJ8biDv2Hc6v8cXn-yVBefQLKpkeJty9N8IcchoankDw/tOePoYD5KdL9HQos1uyE4QsS-LnMn7MG9O25C04nBD8),Terminé,"Emmanuel Meirieu,Louise Loubrieu,France Culture","Science-Fiction,Musical",1:22,1 h 22 min,"Août 1977. Un vaisseau spatial décolle pour l'espace interstellaire avec, à destination de civilisations extra-terrestres, des échantillons de l’humanité. Dont une chanson blues de Blind Willie Johnson, mort en 1949 d’une pneumonie à 40 ans, refusé à l’hôpital parce que noir, pauvre et aveugle.",,https://www.radiofrance.fr/franceculture/podcasts/fictions-theatre-et-cie/dark-was-the-night-d-emmanuel-meirieu-3561214,Français,18/6/2023,,https://www.radiofrance.fr/franceculture/podcasts/fictions-theatre-et-cie/dark-was-the-night-d-emmanuel-meirieu-3561214,,,,,,,,,,,,,"Emmanuel Meirieu, Louise Loubrieu, France Culture"
"""L'Île mystérieuse"" de Jules Verne",mysterieuse.jpg (https://v5.airtableusercontent.com/v1/18/18/1689292800000/2lEwkqq-4hb_LR7cuUC06g/AMxVBHYCZVfq8mC9DPfLS4zaYauLtC5owovmpWAZvvUJM5XsP_GOzk7L1RPvUQDIQYtYOybA8jTdwVnBOHGRIrdd9DfEl3THUNg_pv81THs/Vvkyi-O2qpsGiVFHA_p6v2P8BSP2DxjtPwJTqUOF67g),Terminé,"Stéphane Michaka,France Culture","Science-Fiction,Licence,Historique",1:10,1 h 10 min,"États-Unis, 1865. En pleine guerre de Sécession, quatre Nordistes s'évadent en ballon de la ville de Richmond, capitale la Confédération sudiste. L'ingénieur Cyrus Smith, le journaliste Gédéon Spilett, le jeune Harbert Brown, et Nab, un soldat de l'Union, sont pris dans une tempête qui les fait échouer sur une île du Pacifique. Privés de tout, ces naufragés de l'air doivent assurer leur survie. L'ingéniosité de Cyrus et les ressources de ses compagnons s'allient à merveille. Mais des incidents étranges se succèdent. Une présence mystérieuse semble les épier, guettant la moindre occasion pour leur venir en aide... L'île Lincoln devient alors le théâtre d'une confrontation entre interventions miraculeuses et explications rationnelles. Au siècle de la science et du progrès, de qui la Providence est-elle le nom ?",,https://www.radiofrance.fr/franceculture/podcasts/fictions-theatre-et-cie/concert-fiction-l-ile-mysterieuse-de-jules-verne-1585477,Français,,checked,https://www.radiofrance.fr/franceculture/podcasts/fictions-theatre-et-cie/concert-fiction-l-ile-mysterieuse-de-jules-verne-1585477,,,,,,,,,,,,,"Stéphane Michaka, France Culture"
"""Les glaciers grondants"" de David Lescot",,Terminé,"David Lescot,Sabine Zovighian,France Culture",Policier,1:07,1 h 7 min,"À l’occasion d’une conférence internationale sur le climat, un écrivain doit écrire un article exposant son point de vue sur les dérèglements climatiques. Comme il n’y connaît rien, il se lance dans une enquête, qui devient une quête, presque une passion.",,https://www.radiofrance.fr/franceculture/podcasts/fictions-theatre-et-cie/les-glaciers-grondants-de-david-lescot-9514877,Français,,,https://www.radiofrance.fr/franceculture/podcasts/fictions-theatre-et-cie/les-glaciers-grondants-de-david-lescot-9514877,,,,,,,,,,,,,"David Lescot, Sabine Zovighian, France Culture"
"""Les Hauts de Hurlevent"" d'Emily Brontë",hurlevent.jpg (https://v5.airtableusercontent.com/v1/18/18/1689292800000/nxf0jX_OvucqEE30h4j2Cg/_nCwKcFmpB4rg2LQxyZsDFw4QIUlD1TwqSvdJjq_nkqZzph4kc0RarwjCeUtEelYl4PFZjKQyP1o3RnAtHgIU-4NshBs5N-QiaVQPqNPr4k/isrtwkTLGFOIanvLBUpiKSYwKu_1IsrNxFUhBUJLg_U),Terminé,"Juliette Heymann,France Culture",Licence,4:44,4 h 44 min,"Les Hauts de Hurlevent  -  Wuthering Heights - sont des terres situées au sommet d’une colline et balayées par les vents du nord. Dans une ferme isolée, M. Earnshaw y a recueilli un petit sauvageon, Heathcliff, pour l'élever comme l'un des siens. Violemment rejeté par Hindley, le fils aîné, Heathcliff noue une amitié fusionnelle avec sa sœur d'adoption, la farouche Catherine. Ils parlent peu, s'évadent dans la lande dès qu'une porte s'ouvre, en reviennent crottés et complices. Heathcliff se fait rosser, Catherine pleure. Le lendemain, ils recommencent. Mais à la mort d'Earnshaw, Hindley peut enfin laisser sa haine s'abattre sur Heathcliff : le destin des deux enfants vacille alors... C’est le poids de ce destin qu’Emily Brontë a imaginé dans son unique roman publié en 1847 sous le pseudonyme d’Ellis Bell. Juste un an avant sa mort, à tout juste trente ans.",,https://www.radiofrance.fr/franceculture/podcasts/serie-les-hauts-de-hurlevent-de-emilie-bronte,Français,,checked,https://www.radiofrance.fr/franceculture/podcasts/serie-les-hauts-de-hurlevent-de-emilie-bronte,,,,,,,,,,,,,"Juliette Heymann, France Culture"
"""Les Révoltés de la Bounty"" de Jules Verne",bounty.jpg (https://v5.airtableusercontent.com/v1/18/18/1689292800000/h4GFxNaS3gjogakf8nAF8Q/4hCca3ruthMAzQU3lwuvcTbJZfEVik5xCqU1sKgCgvcVV7K-_DNBzmdZYsvqBRd5N1kXxJDX_78ue5vdx4b58hs7U1SFTo7f-zCMBLae-mw/6FSjLh0_OBxyhXTLJuxSLThOOou2u-jGbgIzVgE87gw),Terminé,"Sophie-Aude Picon,France Culture",Historique,0:47,47 min,"En décembre 1787, la Bounty quitte l'Angleterre sous le commandement du capitaine William Bligh, un homme cruel et colérique. Le navire fait voile vers Tahiti lorsque éclate une mutinerie menée par son second, Fletcher Christian.",,https://www.radiofrance.fr/franceculture/podcasts/fictions-theatre-et-cie/les-revoltes-de-la-bounty-de-jules-verne-6142667,Français,,checked,https://www.radiofrance.fr/franceculture/podcasts/fictions-theatre-et-cie/les-revoltes-de-la-bounty-de-jules-verne-6142667,,,,,,,,,,,,,"Sophie-Aude Picon, France Culture"
"""Les Voyages de Gulliver"" de Jonathan Swift",gulliver.jpg (https://v5.airtableusercontent.com/v1/18/18/1689292800000/WkZCTewWZypbubOZuZ00Aw/WrvPjNfzg4L5ptxaTbyNrq5hOBB31F4m6BxrGejryRjLuJFiEsUyX4e2tcyUfl3DrFr2kybS1F61RPADI3mSEyPQeS1_GWNR3VZTGeWw_mw/XyjOMe6IeR3yB0Fq1aX1nNLOwcp21Rx8dU3VFGVgVYw),Terminé,"Laure Egoroff,Pierre Senges,France Culture","Enfant,Licence",1:02,1 h 2 min,"Quand il échoue sur l’île de Lilliput, Lemuel Gulliver ne se doute pas qu’il va découvrir le peuple le plus étonnant qui soit. Ou plutôt, ce sont les Lilliputiens, créatures minuscules, qui font la découverte de Gulliver...",,https://www.radiofrance.fr/franceculture/podcasts/fictions-theatre-et-cie/concert-fiction-les-voyages-de-gulliver-de-jonathan-swift-8264993,Français,4/6/2023,,https://www.radiofrance.fr/franceculture/podcasts/fictions-theatre-et-cie/concert-fiction-les-voyages-de-gulliver-de-jonathan-swift-8264993,,,,,,,,,,,,,"Laure Egoroff, Pierre Senges, France Culture"
"""Mon visage d'insomnie"" de Samuel Gallet",,Terminé,"Louise Loubrieu,France Culture",Thriller,0:58,58 min,"Un centre d’accueil pour mineurs dans un village en bord de mer. Harouna, 16 ans, n’est pas parti avec ses camarades au ski. Seuls avec lui, sa jeune éducatrice qui va devoir partir, et un homme tout juste arrivé pour la remplacer. Un huis clos en forme de thriller d’épouvante.",,https://www.radiofrance.fr/franceculture/podcasts/fictions-theatre-et-cie/mon-visage-d-insomnie-de-samuel-gallet-5564933,Français,28/5/2023,,https://www.radiofrance.fr/franceculture/podcasts/fictions-theatre-et-cie/mon-visage-d-insomnie-de-samuel-gallet-5564933,,,,,,,,,,,,,"Louise Loubrieu, France Culture"
"""Pinocchio"" de Carlo Collodi",pinocchio.jpg (https://v5.airtableusercontent.com/v1/18/18/1689292800000/SMxi7gbq7XFFF7uZk29feA/PQG0PJBk7Wv_MjcXI3L820ByHWzv4kDKA4EYj-9jNdnoYyV8nIJnuxRjDFBcmZ4DR1yetojZBAHcJDVPia0cZQc7D2Cau-uUPnET8M2DAgc/Eh7u0NUy3WpdHpUY0S3OweH8fRD0bWISeIpVL0GPP9s),Terminé,"Cédric Aussir,France Culture","Théâtre,Enfant,Licence",1:18,1 h 18 min,"Entrez dans l'atelier de Geppetto, et du pays des nigauds au ventre de la baleine, suivez les aventures du plus célèbre pantin de bois grâce à ce concert-fiction qui réunit comédiens, musiciens de l'Orchestre Philharmonique de Radio France et bruiteurs pour célébrer le chef-d’œuvre de Carlo Collodi.",,https://www.radiofrance.fr/franceculture/podcasts/fictions-theatre-et-cie/concert-fiction-pinocchio-de-carlo-collodi-4258556,Français,,checked,https://www.radiofrance.fr/franceculture/podcasts/fictions-theatre-et-cie/concert-fiction-pinocchio-de-carlo-collodi-4258556,,,,,,,,,,,,,"Cédric Aussir, France Culture"
"""Solaris"" d'après le scénario d'Andreï Tarkovski et le roman de Stanislas Lem",solaris.png (https://v5.airtableusercontent.com/v1/18/18/1689292800000/bXEUU49uaWlTfVDkSzUu2A/FShPv8FoiHYikyGQdx9wV4BbXI9cvPhHzfi4BQympb8w1PYUNp6JAPYk0QpOG9U2UJdjL91j6vxJ5Kd4hBAAXoGqfp0rSZWyUmomINwte90/dZ73B417PuIOK52Nz3A-JaI882aunv0iszPEy7EbbG4),Terminé,"Christophe Hocké,Camille Azaïs,France Culture",Science-Fiction,1:15,1 h 15 min,"Le scientifique Kris Kelvin est envoyé en mission sur Solaris, une planète mystérieuse recouverte d’un immense océan. Une fois sur la station, il découvre que d’étranges ""visiteurs"" hantent ses couloirs. Ils apparaissent la nuit, lorsque les membres de l’équipe dorment…",,https://www.radiofrance.fr/franceculture/podcasts/fictions-theatre-et-cie/solaris-d-apres-le-scenario-d-andrei-tarkovski-et-le-roman-de-stanislas-lem-5151288,Français,22/1/2023,,https://www.radiofrance.fr/franceculture/podcasts/fictions-theatre-et-cie/solaris-d-apres-le-scenario-d-andrei-tarkovski-et-le-roman-de-stanislas-lem-5151288,,,,,,,,"TJP,TJP2023",,,,,"Christophe Hocké, Camille Azaïs, France Culture"
"""Viper’s dream"" de Jake Lamar",viper.jpg (https://v5.airtableusercontent.com/v1/18/18/1689292800000/qTRnbQ4z-zKZUPybLAEDeA/e0SDofAt7gePBtsGC1SCPwlmVRYV9YWdSzBJR7O1zMWsJfAOiKzOesdEM91mf5vx-CrpbXQKVrNXbsJHzO-7ylDqd5OWhyLJBgOsMvtWHvE/hoHKLHL2NUbv9lm-wuCt9QD6iJPaYsmSSRFWY7di3p0),Terminé,"Laurence Courtois,France Culture","Historique,Musical,Drame,Policier",,Non définie,"Viper’s Dream (ou Le Rêve de la Vipère) est un drame policier qui a pour décor le monde du jazz à Harlem entre 1936 et 1961. Le récit de la vie de Clyde Morton, surnommé The Viper, un gangster Afro-Américain, ressemble à un roman noir épique, mais écrit pour la radio et baigné dans la musique. On y croise notamment Duke Ellington, Thelonious Monk et Charlie Parker dans la grande maison de la baronne Pannonica de Koenigswater qui, au milieu d’une centaine de chats (la maison fut baptisée Cathouse par les habitués), soutient les jazzmen et les accueille nuit et jour sur les bords de l’Hudson. Jazz donc, mais aussi meurtres, drogues, flics et truands traversent ce feuilleton à un rythme effréné.",,https://www.radiofrance.fr/franceculture/podcasts/serie-viper-s-dream-de-jake-lamar,Français,15/3/2019,,https://www.radiofrance.fr/franceculture/podcasts/serie-viper-s-dream-de-jake-lamar,,,,,,,,,,,,,"Laurence Courtois, France Culture"
"""Zéro six quinze"" de Pauline Peyrade",,Terminé,"Christophe Hocké,France Culture","Drame,Tranche-de-vie",0:47,47 min,"""Chère Madame, Madame le Juge, Il est très important que vous sachiez ce qui s’est vraiment passé, que vous ayez tous les éléments de l’enquête, Rien n'a changé ça se voyait pas le jour où c'est arrivé c'était un jour comme les autres",,https://www.radiofrance.fr/franceculture/podcasts/fictions-theatre-et-cie/zero-six-quinze-de-pauline-peyrade-1642246,Français,28/5/2023,,https://www.radiofrance.fr/franceculture/podcasts/fictions-theatre-et-cie/zero-six-quinze-de-pauline-peyrade-1642246,,,,,,,,,,,,,"Christophe Hocké, France Culture"
1 euro la minute,1euro.png (https://v5.airtableusercontent.com/v1/18/18/1689292800000/nAjrMDJzGD5ewzUgroFDhQ/rZSeZhoKGcjMynlmKRtBBm4iLloUoyI8xQKUkn08rv6fOilGMMrkzB87u19qs48hQBKVriQdZPdoPxu3xh1YgzbkHozzg0ZGukPZPWqcNgI/EyKcj9ZSI9KGRSst_dIkEj9Dmod8mNLbzR-VfIiJZSc),Terminé,"Claire Dubosc,Lauriane Escaffre,Nouvelles Écoutes,Gaumont","Tranche-de-vie,Humour,Érotisme",2:08,2 h 8 min,"Juliette vient de fêter ses 40 ans. Elle vient aussi de se faire virer de son job d'animatrice de supermarché, dernier d'une longue liste de ""petits boulots temporaires"" qui ont finalement duré vingt ans. Le moment est venu de faire le bilan peu glorieux de sa vie : un mari perché, deux ados sans pitié, un bébé pas vraiment désiré et pas beaucoup d’euros dans la tirelire. Bon. Soyons honnête, ses rêves de gosse sont très très loin. Elle aimerait se dire qu'il est temps d'accomplir quelque chose, mais il est surtout temps de trouver de l’argent. Tout bascule lorsque, au pied du mur, Juliette postule auprès d’une entreprise de téléphone rose. Et si c’était l’aventure de sa vie ?",5,https://nouvellesecoutes.fr/podcast/1-euro-la-minute/,Français,4/7/2022,checked,https://nouvellesecoutes.fr/podcast/1-euro-la-minute/,https://www.youtube.com/watch?v=Qmrnkws_5-M,https://rss.art19.com/1-euro-la-minute,,https://open.spotify.com/show/4Mnv9xigZBRVr00k1XC3Fi,,Paris Podcast Festival,,Zeni1,,,,,"Claire Dubosc, Lauriane Escaffre, Nouvelles Écoutes, Gaumont"
2 heures pour Blake,blake.png (https://v5.airtableusercontent.com/v1/18/18/1689292800000/sM68lzx7i82zwLF17WU_2w/bhJW7o3HLqwGj7lH39AzztzHf0nWE3xpXrtPnJdbc07XDKZ5NQfqfjRt5Na-EW36FuMaHSFw4WDEKQQcbTDty6leZB-ognmNA82XKzxoLBw/DOYKshnpqYt3VCQrgUCB8I-riawTr8nvtsFcr4k0pjE),Terminé,"Bertrand dal Vecchio,Engle",Policier,,Non définie,"Bonnie Lee Bakley, la femme de l’acteur Robert Blake, célèbre pour son rôle dans la série des années 70 Beretta, est assassiné en pleine rue par un mystérieux tueur qui prend la fuite. Un an plus tard, dans le huis clos d’une réunion de travail avec les policiers chargés de l’enquête, Maureen Johnson, une jeune substitut idéaliste et opiniâtre, tente de convaincre son patron de la culpabilité de Robert Blake. Le procureur de Los Angeles lui accorde deux heures pour le convaincre, deux heures et pas une minute de plus.",,https://podlink.to/englefictions,Français,17/1/2022,,https://www.engle.fr/2-heures-pour-blake,,,,https://open.spotify.com/show/3juUDy6sfTmFSrlAbkPaIH?si=4d594eb8af994259&nd=1,,,,Zeni1,,,,,"Bertrand dal Vecchio, Engle"
24 histoires pour attendre Noël,api-noël.jpeg (https://v5.airtableusercontent.com/v1/18/18/1689292800000/2SpQRhv1G_T1r2qJTSMRQA/xdBVxhZZhrZZeKPMGZbdOvDWnzxExErkehHUGnYuM7IRA7T43GpwCphYYQMX1MMxI9ql7FLbF-G1Mhfv59F0O_xP3wq-UkP-aq6Lkma2oAU/7SzoBcEeqnqj5UI4feJTVaZE6f_7wfxMCBIh-1rS6GU),En cours,"Marine Gerald,Anne Ricou,Marie-Pascale Nicolas-Cocagne",Enfant,,Non définie,"Noël arrive et l'impatience des enfants grandit, grandit ! Pour mieux goûter l'arrivée du grand jour, Pomme d'Api vous propose chaque jour une nouvelle histoire à écouter en famille. Un podcast rempli de tendresse, d'humour et de douceur, en forme de calendrier de l'Avent.",,https://podcast.ausha.co/pomme-d-api-24-histoires-pour-noel,Français,,checked,https://podcast.ausha.co/pomme-d-api-24-histoires-pour-noel,https://www.youtube.com/watch?v=LrsgkcqevKE&list=PLhrxsF7_LIjWSTyoM93hJrPaZNqlpQqFT,https://feed.ausha.co/b7zAOcvwJGP1,,https://open.spotify.com/show/1zWGjgKMHGRwltMSLyJRoU,,,,,,,,,"Marine Gerald, Anne Ricou, Marie-Pascale Nicolas-Cocagne"
36 Questions,36.png (https://v5.airtableusercontent.com/v1/18/18/1689292800000/r0K0CbT3m82viMVvXber9g/80yIzsUmUZXbkS29FESiYMK3HpMJXGOXyhUhu9Ut99xXNBbF0yyjPAdUYvBxwJBrRdI489OSF8RqnyUbUOaCsA/pnZ1iRlZbox1wck0kJblYYNjv_jmFDZ88SMD4UeC9fs),Terminé,"Ellen Winter,Chris Littler,Two-Up","Musical,Tranche-de-vie",2:28,2 h 28 min,"In a last-ditch attempt to salvage their crumbling marriage, a couple uses the 36 questions—an experiment known for making strangers fall in love—to save their own relationship.",,https://twoupproductions.com/36-questions/podcast,Anglais,,checked,https://twoupproductions.com/36-questions/podcast,,,,,,,,"TJP2022,TJP",,,,,"Ellen Winter, Chris Littler, Two-Up"
"57, rue de Varenne",varenne.jpg (https://v5.airtableusercontent.com/v1/18/18/1689292800000/RsnYp2Gn6Sk4d3uxKwQXRw/PBm6Duvv4w4ExNPcWo_Osp_PIKS_ceJ37KgKgPRVITVWds9hckjEM-G3X6T3Mr-1HJ9RbRG4LtDUFqhzOppXkLMm171lx8udazzG6hKkc38/F4bhJ1QewVeXpuPWLwcxxfxDj9Vl6Ixh23pQ95aQ_E4),Terminé,"François Pérache,Cédric Aussir,France Culture",Politique,12:44,12 h 44 min,"Pierre-Yves Gerland, Premier ministre exsangue après 18 mois de mandat, est réveillé en pleine nuit pour apprendre la disparition mystérieuse de son ministre de la Santé pendant un séjour en Afrique, tandis qu’éclate un scandale autour du logement de fonction du ministre des Finances… En suivant dans ses moindres déplacements Pierre-Yves Gerland, 57, rue de Varenne pénètre les arrière-cours de tous les lieux de pouvoir où se croisent jeunes loups de la politique et grands serviteurs de l’État.",,https://www.franceculture.fr/emissions/fictions-le-feuilleton/57-rue-de-varenne-de-francois-perache-saison-1,Français,18/2/2022,checked,https://www.franceculture.fr/emissions/57-rue-de-varenne,,,,,,,,Zeni1,,,,,"François Pérache, Cédric Aussir, France Culture"
130 BPM,130BPM.jpg (https://v5.airtableusercontent.com/v1/18/18/1689292800000/oT8VOaprF24YYOxVfHsXCw/5__Pf-Dk_VawQjAK6slwaUfa_IRJfuo5vAbuXE9ONFLBmeODvjnvW8Ve-SsjgwPn8YOMFdeFjFXGbSvi83hMTn0705SlzIdSFgkQHOYz7ck/4galBZuMp6YIfmZB8S6Z5JIYE3j0ehRgjepn11NrkTM),Terminé,Antoine Pouille Desanti,Tranche-de-vie,0:07,7 min,Steve est invité pour témoigner à la radio afin d’évoquer son parcours jusqu’au centre de redressement mais a-t-il réellement fini de se remettre de cette période douloureuse ?,5,https://www.youtube.com/watch?v=IlewrMg8mdw,Français,12/12/2022,,https://www.youtube.com/watch?v=IlewrMg8mdw,https://www.youtube.com/watch?v=IlewrMg8mdw,,https://soundcloud.com/asinu92/130-bpm-fiction-sonore,,,,,,,,1. À écouter,,Antoine Pouille Desanti
163,163.jpg (https://v5.airtableusercontent.com/v1/18/18/1689292800000/fyd5T0HN1vzJLQ5MmNuJZA/QAbz0zTEhzaBVYRXs30BC_D2jtDnreoxOlOwHvhh_4ufkK_Ny0_VC-xJojEYwF6W8OuGXkvWq6qkTONis0C-dg/U9DdayM2IVy41qSkYbOzTqNSwD-envRRUkeJGA0TtmM),Terminé,Phil Goud,"Science-Fiction,Post-apo",,Non définie,"Au lendemain du défilé du 14 juillet, des mouvements militaires inhabituels sont repérés un peu partout en France. Le soir, la vidéo–confession d'un scientifique sème l'angoisse : une comète s'abattrait sur le pays de Galles dans 163 heures. Fiction participative qui s'est déroulée en temps réel du 15 au 22 juillet 2017. Les heures indiquées correspondent aux heures réelles des messages sur le répondeur.",,https://163.lepodcast.fr/,Français,,,https://163.lepodcast.fr/,,https://163.lepodcast.fr/rss,,,,,,,,,,,Phil Goud
231 Germaine,germaine.png (https://v5.airtableusercontent.com/v1/18/18/1689292800000/2Ql_6Dxet_QsR0kNUynKzA/1emhEfsSDFyulCUwM5pBdz3GqY9wH3YkrnuaM5BvHFwnS2r1cDfV05SUsXxZ3caToDJxhttOINiJ17QioPTkr69yZLC97QOGlEoUdbRulKQ/_sbJX_Ik2aSMtRMIF6_YWvEJScNqEhceAsIl6f3Xk1g),En cours,"Grushkov,The Grenadines",Science-Fiction,,Non définie,"Dimanche Hachette est la meilleure policière de son commissariat… C’est pour cela qu’elle est transférée sur 231 Germaine, un astéroïde aux confins du Far Space, afin d’y être la toute première commissaire. Aidée du shérif Stacey O’hara, Dimanche va découvrir que sous les apparences pittoresques de cet astéroïde se cachent des choses sordides…",,https://thegrenadines.fr/231-germaine,Français,,,https://thegrenadines.fr/231-germaine,,,,,,,,,,,,,"Grushkov, The Grenadines"
1287,1287.jpg (https://v5.airtableusercontent.com/v1/18/18/1689292800000/eIChEnCW2OGqAz1HVRdEFA/znyxRdgIf7YIKtNSZiK5ejxRKw0lByaG4mRzGUCxPCmdr7rYFZCrB63KoCH7bG86E3g9OGz0fPEwNK_qBHfWSA/hPRHIcd2H_Gjd4STIzDY_APZ9Eqe_pdNB0U9_nXdzRg),Terminé,"Mathieu Quintin,Zylann","Historique,Humour",3:41,3 h 41 min,"1287 (douze cent quatre-vingt sept) est une saga d’histoire alternative (uchronie) suivant l’évolution de la situation dans une Europe de complots et de trahison, deux ans après le couronnement de Philippe IV dit “Le Bel”, le premier Roy de France à acquérir le titre du royaume de Navarre.",5,http://1287.aerrond.com/,Français,2/8/2019,checked,http://1287.aerrond.com/,https://www.youtube.com/watch?v=jZvjPewX8vU&list=PLMTSO5fLj_87-V0XPztqpaePQ5T2YIzzY,http://1287.lepodcast.fr/rss,,,checked,Nuit Sans Image,Mamie Petouse:Vous voulez du café ?,"Zeni1,20",,,,,"Mathieu Quintin, Zylann"
"1940, Winston devient Churchill",churchill.jpg (https://v5.airtableusercontent.com/v1/18/18/1689292800000/USooJWq8WreYQOQSo2iOpQ/bco4_0reV5NerX70naIqZwZ8kcmdqhFkI_GbOwNBIakwuenVjLSnYOc_FGf9KccLfnEb66skAXg-LBBCdyw_c3k96i8b-nHKl4W4QNd_4a0/slZGilFbo-wbjIMnYjoTRp1zTP6h9gGYIC3i86ILELw),Terminé,"Alexandre Lenot,Théo Boulenger",Historique,0:58,58 min,"Une fiction audio originale d'Alexandre Lenot, inspirée du film « Les Heures Sombres » avec Gary Oldman, réalisé par Joe Wright. Revivez les moments décisifs de 1940 du tout nouveau Premier Ministre qui va prendre en main le destin de l'Angleterre alors en guerre.",5,https://play.acast.com/s/churchill/,Français,2/1/2018,checked,https://play.acast.com/s/churchill/,,https://rss.acast.com/churchill,,,,,,Zeni1,https://sphinx.acast.com/churchill/bandeannonce-1940-winstondevientchurchill/media.mp3,,,,"Alexandre Lenot, Théo Boulenger"
À la Rex-cousse,rexcousse.jpg (https://v5.airtableusercontent.com/v1/18/18/1689292800000/2_GgOpvbfA24M5y0BsCMQw/7r5BDp09hbWieMXbQgdBOdkR2tkVjWAYzzV0OdZ2vW1vnsHKvWW8t0sGctsOdSXe7mQBC3v2xSM_lQp2UnxNWFiET1xew0LPWtXpRc03pzo/eXueyfO2rJBfEKNQ4d1R3KOnSMLrEsp3tkP6rvR7bjw),Terminé,Le Sam,"Licence,Parodie",0:06,6 min,"Après sa victoire triomphante, Jeanne décide d'envoyer une équipe de personnages Disney à la recherche de Rex. Et le voyage ne sera pas de tout repos.",5,https://www.youtube.com/watch?v=Y2AxaVwCZmE,Français,,,,https://www.youtube.com/watch?v=Y2AxaVwCZmE,,,,,,,,,3. Noté,,,Le Sam
À Tâtons,tatons.jpg (https://v5.airtableusercontent.com/v1/18/18/1689292800000/K5q01_9VSfIkNWMYUI-fqQ/YnWrliBobzDglrc7m-2qsTsCFPXeJrE4_8YidAkY-DBUc3dAJ6MVPYxDMoxZ4lVa6WwI6VwKEgjVfeMHHOmsLP4cxIFd2u19jN1ZNIytlsg/7O2Cn5rSq6ZQJRBksxXw0QSREfQ6uPtsRu0aPugNLvw),Terminé,Mehdi B.,Policier,,Non définie,"Alice est aveugle. Plongée dans le noir depuis sa naissance, attentive aux sons et aux parfums, elle comble son ennui en s’adonnant à un passe-temps singulier : résoudre des affaires criminelles. Au fil des années, ce hobby lui a conféré une célébrité considérable. Son visage fait la une des journaux et son nom circule dans tous les commissariats de Bruxelles.",,https://www.radiola.be/serie/a-tatons/,Français,30/11/2022,,https://www.radiola.be/serie/a-tatons/,,,,https://open.spotify.com/show/1HKUGRYVtXh2LQ7b8LEWlv,,,,Zeni1,,,,,Mehdi B.
AAAAAH,aaaaah.jpg (https://v5.airtableusercontent.com/v1/18/18/1689292800000/hhl9ASHCMh8j1e3eFWKZKQ/JAClcNSsaUfHBiVm7rkYGKgS-eIkT_X0KP0c__99PJW4t3CeDPQHwgVb5BZuSygYpXqntNnjib99ZZ-EtwSh9escHPvjxNqvNZuOFsL7XjE/m7S_Ri2Zy79Msa3EkucciDJwoIzmtEiRblJtd7C_fGI),Terminé,"Richoult,Javras,Brigade d’Improvisation Spéciale Extrême",Parodie,0:19,19 min,,5,https://javras.fr/sagas-mp3/aaaaah/,Français,,checked,https://javras.fr/sagas-mp3/aaaaah/,,https://javras.fr/feed/podcast/aaaaah,,https://open.spotify.com/show/6wIelrSPUA7qV0ZiiQAa0Z,,,Tous:AAAAAAAAAAAH,,,,,,"Richoult, Javras, Brigade d’Improvisation Spéciale Extrême"
ADN 2082,adn2082.jpg (https://v5.airtableusercontent.com/v1/18/18/1689292800000/siQtdFIBaaHnaykfJ7vCYQ/xOFtMUwhGhFlFxyorphHwJDTh2bFOsv-PLxA5CwB2fm_3URPepit3Kl2UEIcxjyDS-wZmVwsOX_E387u87FmVCBEX2dfMXxADUF9co6UFRc/PmRq5A1gRqNRIEPOxoX7dlqkQvCBPnDVyDL9Lcu88oc),Terminé,François TJP,"Science-Fiction,Post-apo",2:11,2 h 11 min,"Aujourd’hui, Alice raconte ses enquêtes. Partagée entre ses activités de professeure de piano, son amitié avec un commissaire vieillissant et sa passion pour Zoé, une femme au tempérament brûlant, Alice poursuit dans l’ombre la trace de son grand frère disparu et tente de mettre à jour les agissements de la mystérieuse Madame Liu.",5,https://www.studiotjp.com/adn2082/,Français,10/6/2015,checked,https://www.studiotjp.com/adn2082/,https://www.youtube.com/watch?v=J-oO417BRTw&list=PLR3_sTHVLKhcVMHndEJ5piw7EEJ4WjNMs,https://www.studiotjp.com/adn2082/episodes/podcast.xml,,,,,,"Club écoute,Zeni1",,,,,François TJP
