Nom,Pochette,Statut,Auteur,Genre,Durée,Somme,Synopsis,Note,Site,Langue,MP3,Website,Youtube,RSS,Soundcloud,Spotify,Discord,Récompense,Citation,Recommandation,Bande-annonce,NSI 2022,Message Insta,Auteurs
Encore une histoire,encore-une-histoire.jpeg (https://dl.airtable.com/.attachments/3d9c1ba9e17d4dbbc710b28cb95e0e2e/d2ecad77/encore-une-histoire.jpeg),En cours,"Céline Kallmann,Alexandre Ferreira",Enfant,,0:00,"Encore une histoire est un podcast destiné aux enfants (et à ceux qui le sont encore dans leur tête) qui aiment qu'on leur raconte des histoires. Chaque semaine, vous retrouverez ici une histoire lue, tirée d'un livre de littérature jeunesse ou une création originale. À écouter avant de se coucher, allongé dans l'herbe, dans la voiture ou dans le train, Encore une histoire veut mettre en avant la formidable création littéraire destinée aux jeunes lecteurs (et aux moins jeunes, donc).",5,https://podcast.ausha.co/encore-une-histoire,Français,checked,https://podcast.ausha.co/encore-une-histoire,,https://feed.ausha.co/BNXMdhnKwlOe,,https://open.spotify.com/show/6E0EyfV64HHUJvOYG2eBY5,,,,,,,,"Céline Kallmann, Alexandre Ferreira"
Enfants d’Atlas,enfants.jpg (https://dl.airtable.com/.attachments/300be22635cf1fa468c75c332afc1c6e/5bc10f18/enfants.jpg),En cours,"Tamica,Oriog Créations",Policier,0:28,0:00,"Laura a grandi dans la rancœur envers son père, Charles, qui l’a abandonnée lorsqu’elle n’avait que sept ans, alors que sa mère venait de mourir. Des années plus tard, lorsqu’elle apprend sa mort, elle découvre un héritage qu’elle n’aurait jamais soupçonné. Elle se retrouve, bien malgré elle, embarquée sur les traces… tumultueuses de son père.",,https://enfants-d-atlas.lepodcast.fr/,Français,checked,https://oriogcreations.fr/fictions/gollwyd/enfant-datlas/,https://www.youtube.com/watch?v=AI-hswnLH1g,https://enfants-d-atlas.lepodcast.fr/rss,,,,,,TJP2019,,,,"Tamica, Oriog Créations"
Erika et les princes en détresse,erika.png (https://dl.airtable.com/.attachments/b3401f530cbf2a82ffc1d8291edd67f7/c4c95d13/erika.png),En cours,"Richoult,Gihellcy,Javras","Fantasy,Licence",0:43,0:00,"Erika, notre princesse, compte bien succéder à sa mère et prendre le pouvoir seule sauf que… Elle ne veut pas se marier ! Et donc, pour échapper à cette tradition on lui confie une mission : celle de sauver des princes en détresse ! Cette quête tombe à pic pour la reine qui va pouvoir s’en servir à son avantage…",5,https://javras.fr/sagas-mp3/erika-et-les-princes-en-detresse/,Français,checked,https://javras.fr/sagas-mp3/erika-et-les-princes-en-detresse/,,https://javras.fr/feed/podcast/erika-et-les-princes-en-detresse,,https://open.spotify.com/show/4KEMhzNhmpofF4GAnmNL0h,,,?:Qui va vous aider à laver vos culottes sales ?,,,,,"Richoult, Gihellcy, Javras"
Et la Terre éclata...,etLaTerreEclata.jpg (https://dl.airtable.com/.attachments/dfd9db7a3b0d3f43b73799a013b58d3d/d2dd7173/etLaTerreEclata.jpg),Terminé,"François TJP,MimiRyudo,Studio TJP","Science-Fiction,Humour",3:03,0:00,Des capsules de Science-Fiction Radiophonique qui vous racontent simplement... la Fin du Monde.,5,https://boum.studiotjp.com/,Français,checked,https://boum.studiotjp.com/,https://www.youtube.com/playlist?list=PLR3_sTHVLKhdXrjsVMT6kw6hLCu4mBlVn,http://elte.lepodcast.fr/rss,,https://open.spotify.com/show/6QQKX8m2uHhcEss8KP1gSx,,,,Zeni1,,3. Noté,,"François TJP, MimiRyudo, Studio TJP"
Evil&Co,evil.jpg (https://dl.airtable.com/.attachments/a468871ed1de55b4e4169e13d1dac986/2f4f7714/evil.jpg),Terminé,"Adrien Berthalon,SoundStorm Productions","Humour,Tranche-de-vie",1:00,0:00,"« À quoi on sert ? Au début, j'en avais pas la moindre idée. Et puis j'ai entendu un jour dans le hall qu'Evil&Co devait faire monter le nombre de tampons rouges à l'entrée du purgatoire... Ça m'a fait tout drôle de savoir que j'étais utile, j'avoue. Surtout sans le faire exprès en fait ! Ah, attendez, y'a Gerard ! Ça fait 3 jours que je lui baisse son froc en criant ""escalope"", il essaye toujours de comprendre pourquoi ! »
- Tuc, employé du service ressources humaines d’Evil&Co.",,https://evilco.lepodcast.fr/,Français,checked,https://soundstorm-productions.net/serials.php,https://www.youtube.com/watch?v=SLzo-ENmlnE&list=PLZnk_KyYWXhCfowNbDOxyEZWBuhZpKHKK,https://evilco.lepodcast.fr/rss,,,,,,,,,,"Adrien Berthalon, SoundStorm Productions"
Exobiologie et Exocivilisation Virginienne,exobiologie.jpg (https://dl.airtable.com/.attachments/a7bea1d26967894fa86d1fb7b23b1218/12175ee8/exobiologie.jpg),Terminé,François Courtis,Science-Fiction,2:36,0:00,"Le 12 mai 2017 l'Humanité recevait le message d’une civilisation extraterrestre localisée dans le système planétaire de Proxima Virginis. Plus de 25 ans après la réception de ce message, il convient de faire le bilan : que sait-on de l'exocivilisation virginienne sur le plan biologique et sociétale ? Pour répondre à ces questions, avec l'Université Polytechnique Lyon - St Étienne, nous vous invitons à vous inscrire au cours Exobiologie et exocivilisation virginienne.",5,https://anchor.fm/francois-courtis/episodes/Bande-annonce-du-cours-eei9od,Français,checked,https://anchor.fm/francois-courtis/episodes/Bande-annonce-du-cours-eei9od,,https://anchor.fm/s/20b98a00/podcast/rss,,https://open.spotify.com/show/2k7s06OUA1uinQ6XuI1dYL,,,,,https://d3ctxlq1ktw2nl.cloudfront.net/production/2020-4-25/76576035-48000-2-8886897737096.mp3,,,François Courtis
Exquises Fictions,exquises.jpeg (https://dl.airtable.com/.attachments/a4ee5e57b509e4c16072cbc26a5c76f7/805c9716/exquises.jpeg),En cours,David Geiger,Science-Fiction,,0:00,"Le cadavre exquis, vous connaissez ? Mais le podcast exquis, ça, vous ne devez pas connaitre. Quelqu'un crée une histoire et la raconte à la façon d'un livre audio. Une autre personne écrit la suite et la raconte de la même façon. Qu'arrivera-t-il à la fin de la saison ? Vous le saurez en écoutant ""Exquises Fictions"".",,https://podcast.ausha.co/ExquisesFictions,Français,checked,https://www.plopcast.fr/les-emissions/exquises-fictions/,,https://feed.ausha.co/mb5d4Sglw1Dy,,https://open.spotify.com/show/5xiaq0EBaE6aciz30FxLpt,,,,TJP2019,,,,David Geiger
"Fantômas, le génie du crime",fantomas1.jpg (https://dl.airtable.com/.attachments/47085fe459ed1ec8cbb43365735629ac/50293cdd/fantomas1.jpg),Terminé,"Jean-Matthieu Zahnd,Xavier Maumejean",Policier,0:59,0:00,"Tout accuse Jérôme Fandor, jeune journaliste enthousiaste à La Capitale. La jolie Hélène est bouleversée,  le juge Bonnet fait appel à l’inspecteur Juve. Pour le plus grand policier de France, le meurtre est l’œuvre d’un esthète, d’un artiste du crime. Tout comme l’assassinat de lord Beltham évoque  le style de celui qui tient Paris dans les chaînes. Des troquets pour Apaches aux immeubles de Neuilly, nul n’ose en parler à voix haute, y compris lady Beltham, sa splendide maîtresse. Le Prince de l’Épouvante est disposé à défier la guillotine afin que la foule scande son nom : Fantômas !",5,https://www.franceculture.fr/emissions/fictions-samedi-noir/fantomas-le-genie-du-crime-de-pierre-souvestre-et-marcel-allain,Français,checked,https://www.franceculture.fr/emissions/fictions-samedi-noir/fantomas-le-genie-du-crime-de-pierre-souvestre-et-marcel-allain,,,,,,,,,,,,"Jean-Matthieu Zahnd, Xavier Maumejean"
Ferme les yeux et regarde,ferme.jpg (https://dl.airtable.com/.attachments/ac5ea34edd0ac14ea3fc173f4a7aa210/ca71806c/ferme.jpg),Terminé,"Jérémie Nicolas,Élodie Parmentier,Mathilde Anquez",Tranche-de-vie,,0:00,"Et si on imaginait des histoires à partir de grands chefs-d’œuvre ? Et si les œuvres prenaient vie par le son ? Comme si nous, humains, avions la faculté de nous transporter dans les tableaux ?",5,https://open.spotify.com/show/7EA1E13zjQuLEjCnBeZf63,Français,,https://open.spotify.com/show/7EA1E13zjQuLEjCnBeZf63,,,,https://open.spotify.com/show/7EA1E13zjQuLEjCnBeZf63,,,,,,,,"Jérémie Nicolas, Élodie Parmentier, Mathilde Anquez"
Fin de citation,citation.jpg (https://dl.airtable.com/.attachments/6a7842814eba7acd7ca1c2304e108bb6/bd3c5535/citation.jpg),Terminé,"Alexandre Choiselat,Thomas Adda,Sodasound","Policier,Musical",0:57,0:00,"« Avec un grand verre de lait et un petit sombrero » est la première saison d’une série musicale dont chaque chanson constitue un épisode. Ces morceaux mis bout à bout vous permettront de reconstituer le puzzle de ce polar moderne. On y suit 6 personnages hauts en couleurs dans une aventure urbaine rocambolesque. D'un côté Didier Chadot, K-Nif, Guilty Fixer, 3 musiciens vivant dans la marge et cherchant une solution rapide pour financer leur premier album. De l'autre, Ange Marsulacci petit truand médiocre œuvrant dans l'ombre de son père, et son lieutenant Street Credibility, jeune femme à la violence assumée. Deux univers opposés qui vont se percuter de plein fouet.",5,https://podcloud.fr/podcast/fin-de-citation,Français,checked,https://www.findecitation.com/,,https://fin-de-citation.lepodcast.fr/rss,,,,,,"TJP2021,Zeni1",,3. Noté,,"Alexandre Choiselat, Thomas Adda, Sodasound"
Forêt/Cache/Arbre,foret.jpg (https://dl.airtable.com/.attachments/c0610f25505a928df82ca6a655a51e71/f3930dd4/foret.jpg),Terminé,Alice Kudlak,"Science-Fiction,Horreur,Fantastique",1:51,0:00,"Forêt / Cache / Arbre est une série audio et initiatique entre science-fiction, horreur et fantastique, racontée sur le mode du found footage.",5,https://www.foretcachearbre.com/,Français,,https://www.foretcachearbre.com/,https://www.youtube.com/watch?v=uAWdSOcmTzU&list=PLoyDd5KxkXRYGwjZQw9Bf_yCotg-CWRqa&index=2,,https://soundcloud.com/user-643642948,,,,"Bernie:Oh ben t'inquiète, elle va la bouffer sa Danette.","Pour découvrir le genre,TJP2019,Club écoute,Zeni1",,,,Alice Kudlak
Fragments Hackés d'un Futur qui résiste,futur.jpg (https://dl.airtable.com/.attachments/98f9b085cb686362489ff75f8fcaff22/96f93161/futur.jpg),Terminé,"Alain Damasio,Tarabust","Science-Fiction,Post-apo,Documentaire",0:52,0:00,"Le 8 mars 2014, un hacker tchèque a réussi à décrypter six fichiers audio issus du futur. La censure des gouvernements européens a été immédiate mais quelques copies ont été sauvegardées sur des serveurs clandestins. Contacté par des internautes anonymes, le Festival des Libertés de Bruxelles a décidé, après de multiples débats, de les diffuser en écoute intégrale. Ces documents sonores sont un témoignage exceptionnel de l’insurrection civique des habitants d’une ville privatisée, en 2034.",,https://soundcloud.com/phaune-radio/sets/fragments-hackes,Français,checked,https://soundcloud.com/phaune-radio/sets/fragments-hackes,,,https://soundcloud.com/phaune-radio/sets/fragments-hackes,,,,,,,,,"Alain Damasio, Tarabust"
Frite,frite.jpg (https://dl.airtable.com/.attachments/df57dc36ce16500e6f685a17918984c7/90c5561b/frite.jpg),Terminé,"Cladall,Zylann","Humour,Tranche-de-vie",0:32,0:00,"Quelque part, en pleine cambrousse, un routier s’arrête dans un routier, car son estomac lui réclame de l’aide… Mais alors qu’il commence à déguster son repas, il ne se doute pas qu’une si petite envie peut faire basculer le sort de l’humanité…",5,http://www.wavesavengers.fr/creations-audio/frite/,Français,checked,http://www.wavesavengers.fr/creations-audio/frite/,,http://frite.lepodcast.fr/rss,,,,,,,,,,"Cladall, Zylann"
Frootch,Frootch.jpeg (https://dl.airtable.com/.attachments/f31280a9af3ac900861a466d799f0b20/c95c5a9a/Frootch.jpeg),En cours,Sarah Treille Stefani,Tranche-de-vie,,0:00,"Un micro caché au fond de son sac, Sarah nous embarque à tous ses rendez-vous professionnels ou amoureux, qu'ils soient foireux ou jouissifs. De ses soirées trop arrosées, ses déclarations gênantes à ses refus douloureux, on vit bien caché derrière elle, toutes ses petites victoires à ses grandes humiliations. Tous ces instants sont brut, sans filtre. Dans Frootch vous assistez à la vie de Sarah, jeune comédienne qui tente tant bien que mal de se faire une place dans l’impitoyable monde du cinéma et dans le monde... tout court. Frootch c’est l’histoire de Sarah, hypersensible et timide, qui tente de conquérir le monde, avec vous.",,https://open.spotify.com/show/1BiTzQjSsOZ2nTbv24JiQ1,Français,,https://podcast.ausha.co/frootch,,https://feed.ausha.co/bYPVaS10Ppjr,https://soundcloud.com/arahts,https://open.spotify.com/show/1BiTzQjSsOZ2nTbv24JiQ1,,Paris Podcast Festival,,"TJP2019,Zeni1,TJP2022",,,,Sarah Treille Stefani
Game Lover,game-lover2.jpg (https://dl.airtable.com/.attachments/a9ff5fa9832d797be224a535cce239f7/53aeae58/game-lover2.jpg),Terminé,"Annabelle Martella,Emilie Mendy",Tranche-de-vie,1:08,0:00,"Toute une nuit, une jeune femme armée d’un bazooka arpente une jungle extraterrestre à la recherche de son amour. Elle ignore que pendant ce temps, sur deux autres serveurs, quatre adolescents s’aiment désespérément, s’éprouvant lors de combats sanglants. Dans Lifespan, jeu vidéo fictif où cohabitent un univers galactique (Calycé), un médiéval (Arthéros) et un paradisiaque (L’île aux rochers), les relations naissent dans des paysages surréalistes, au gré de batailles trépidantes et de quêtes pour rendre le monde meilleur. Une vie aventureuse très différente de celle menée IRL (in real life) où on se tape un quotidien plan-plan, une gueule de merde, un monde inégalitaire et pollué et en plus de ça des parents chiants.",5,https://www.arteradio.com/serie/game_lover,Français,checked,https://www.arteradio.com/serie/game_lover,,https://www.arteradio.com/xml_sound_serie?seriename=%22Game%20Lover%22,,,,,,TJP2021,,,,"Annabelle Martella, Emilie Mendy"
Garibaldy et Giolito,garibaldy.jpg (https://dl.airtable.com/.attachments/dee822ef9029280718830846a14d3fe6/b8579779/garibaldy.jpg),Terminé,"Paul Bouyssou,Hugo Bouyssou,Émilie Bouyssou,Gary Bouyssou",Enfant,1:18,0:00,"Au royaume du roi Maïs, Giolito et Gariblady, accompagnés de leurs animaux de compagnie, vivent des histoires fantastiques. Ces contes sont destinés aux enfants.",,https://garibaldi.lepodcast.fr/index.css.html,Français,checked,,,https://garibaldi.lepodcast.fr/rss,,https://open.spotify.com/show/7qK01MF3Xav0LrhOSiYdCu,,,,,,,,"Paul Bouyssou, Hugo Bouyssou, Émilie Bouyssou, Gary Bouyssou"
Grim Reapers,grim-reapers.jpg (https://dl.airtable.com/.attachments/11a077c7f02540dbeba3eff6fd75e956/22cbc2ba/grim-reapers.jpg),Terminé,"Gihellcy,Javras","Fantasy,Fantastique",0:34,0:34,"Quand Night, meilleur faucheur de Purgatoire, se voit assigner à contre-cœur une mission qu’il ne peut refuser, tout ne se passe pas spécialement comme prévu…",5,https://javras.fr/sagas-mp3/grim-reapers/,Français,checked,https://javras.fr/sagas-mp3/grim-reapers/,https://www.youtube.com/watch?v=57m8vzB87qw&list=PLX9jskeW-ypcOpw3ROXwB8hu_LkqGJgz-,http://www.teamjavras.fr/Javras/feed/podcast/grim-reapers,,https://open.spotify.com/show/4gZ83QR23GS88164S2Ud30,checked,,,,,,,"Gihellcy, Javras"
GTA chez les ploucs,gta.jpg (https://dl.airtable.com/.attachments/7512a58000dbb65577f58d562b3d2df0/3cf0b52a/gta.jpg),Terminé,"Thomas Le Petit-Corps,Simon Lauris,Bokal Média","Humour,Action,Policier",1:38,0:00,"Cette série en cinq épisodes raconte les péripéties d’un tueur à gages devant s’exiler dans le centre Bretagne pour honorer son contrat. Mais une femme aussi sublime qu’intelligente, une bande de joyeux lurons et une secte de fanatiques vont venir troubler ce qui devait être un boulot comme un autre.",,https://podtail.com/podcast/gta-chez-les-ploucs/,Français,checked,https://bokalmedia.wordpress.com/,,,,https://open.spotify.com/show/4Kdp0vIkmStsovnP0rRplE,,,,TJP2022,,,,"Thomas Le Petit-Corps, Simon Lauris, Bokal Média"
Gueri-Eros,gueri-eros.jpg (https://dl.airtable.com/.attachments/56a212b51b1a3b956802b0ad52b15ec8/1130c0b4/gueri-eros.jpg),Terminé,Horine,"Fantasy,Historique",0:57,0:00,,,https://podcloud.fr/podcast/gueri-eros-1,Français,checked,https://aylion.fr/lecheminhorine/fictionsaudio/guerieros/,https://www.youtube.com/playlist?list=PLEwFqEEltwRHbkAnJGEMl1D2ZdOJbsUst,https://gueri-eros.lepodcast.fr/rss,,,,,,,,,,Horine
Gueule de Bois,gueule.png (https://dl.airtable.com/.attachments/068e303199b94a7d646016616f68e208/60f4dfde/gueule.png),Terminé,"Richoult,Javras","Humour,Parodie,Tranche-de-vie",1:04,0:00,"Mais une femme aussi sublime qu’intelligente, une bande de joyeux lurons et une secte de fanatiques vont venir troubler ce qui devait être un boulot comme un autre.",,https://javras.fr/sagas-mp3/gueule-de-bois/,Français,checked,http://www.gueuledebois.teamjavras.fr/,,https://javras.fr/feed/podcast/gueule-de-bois,,https://open.spotify.com/show/7Ln3LRYgAi0AxEllEfr4zy,,,,Club écoute,,,,"Richoult, Javras"
Guillemette,guillemette.jpg (https://dl.airtable.com/.attachments/69eaa4769bea75c00a8fa291dbf2ceba/ba772f02/guillemette.jpg),Terminé,Julie Bonnie,Enfant,0:49,0:00,Les aventures d'une petite fille distraite et rigolote.,,https://www.arteradio.com/serie/guillemette,Français,checked,https://www.arteradio.com/serie/guillemette,,https://www.arteradio.com/xml_sound_serie?seriename=%22GUILLEMETTE%22,,,,,,,,,,Julie Bonnie
Hachi Powaa à l'École des Otaku,hachi.jpg (https://dl.airtable.com/.attachments/45a3acc5cdcecb158bff9b8c2cff4812/91807e4b/hachi.jpg),En cours,Magickirua,"Parodie,Humour,Licence",4:57,0:00,"Hachi est un orphelin recueilli par Harid pour aller à Jobard, l'École des Otaku (les fans de culture japonaise). Il y apprendra bien au chaud les arts du pays du soleil levant tels que les mangas, le cosplay ou encore le karaoké, alors qu'à l'extérieur, un groupe d’infâmes otaku menés par ""Celui-Dont-On-N'arrive-Jamais-A-Prononcer-Le-Nom"" tente d'asservir le monde avec des objets technologiques terrifiants. ",,https://hachipowaa.lepodcast.fr/,Français,checked,https://hachipowaa.lepodcast.fr/,https://www.youtube.com/watch?v=dP82RxtBt-Y&list=PLlTGeG9QL2IavZwogQSmXeLasOrUsmsgx,https://hachipowaa.lepodcast.fr/rss,,,,,,,,,,Magickirua
Hasta Dente !,hastadente.jpg (https://dl.airtable.com/.attachments/0bffd4a142460cbfd2aaf04110ad24b0/d440d23b/hastadente.jpg),Terminé,"Léon Bonnaffé,Cédric Aussir","Policier,Humour",2:32,0:00,"Dans une ville de province, deux policiers, Matteo Razzoni et Karim Meziani, sont chargés d’enquêter sur une affaire apparemment anodine : la découverte d’une cache de ramen (bouillons de nouilles en sachet), de tracts délirants sur l’avènement du ""Dieu spaghetti volant"" et quelques photos d’un député. L’inspecteur Matteo Razzoni est le seul à prendre l’affaire au sérieux et s’obstine contre l’avis de sa cheffe. Il s’avère très vite que la cache appartient à un groupe adepte du pastafarisme, une religion parodique née en réaction aux théories créationnistes américaines, détournant les codes religieux. Ce qui avait d’abord l’air d’une farce va soudain prendre un tour improbable avec l’apparition d’un premier cadavre...",5,https://www.franceculture.fr/emissions/hasta-dente,Français,checked,https://www.franceculture.fr/emissions/hasta-dente,,http://radiofrance-podcast.net/podcast09/rss_18829.xml,,,,,,,,,,"Léon Bonnaffé, Cédric Aussir"
Hectore ou les Chroniques d'un Rastronaute,hectore.jpg (https://dl.airtable.com/.attachments/9f5d9ceb9083fbd68c12e351cbe9753b/7055a313/hectore.jpg),En cours,La Loutre,"Science-Fiction,Humour,Fantastique",5:50,0:00,"22 février 1961, la France place pendant 8 minutes son premier représentant en orbite. Un représentant du nom d'Hector. Bon, après, la réalité à fait des siennes... Et des fois elle trouve de bon ton de se croiser avec d'autres elle même... Pas une histoire de monte parallèle hein... Parce qu'un monde parallèle ça ne se croise pas... Plutôt un monde perpendiculaire... Un angle à moitié aiguë. Et puis 8 minutes plus tard, Hector redescend sur terre... Pendant qu'un autre Hector, lui, reste en orbite, là haut... Ensuite, à partir de là... Disons qu'à partir de la Hector se cherchera... et qui sait ce qu'il va trouver là... Hector ou les Chroniques d'un Rastronaute est une fiction audio. Ou bien, une SAGA MP3. Appelez ça comme vous voulez. Toujours est-il qu'elle s'écoute avec les oreilles, et avec les yeux aussi. Mais les yeux du dedans. Les yeux de l'immagination.",5,https://audioblog.arteradio.com/blog/158604/hector-ou-les-chroniques-d-un-rastronaute,Français,checked,https://audioblog.arteradio.com/blog/158604/hector-ou-les-chroniques-d-un-rastronaute,,https://audioblog.arteradio.com/blog/158604/rss,,,,,,TJP2021,https://sons-audioblogs.arte.tv/audioblogs/v2/sons/158604/158609/podcast_158609_h97Q9.mp3,3. Noté,,La Loutre
HERO,hero.png (https://dl.airtable.com/.attachments/9077574a9debb28f0ea1cf780f31ca2d/e5703f47/hero.png),Terminé,"Magero,Belisair House",Action,0:44,0:00,"Dans un futur pas si lointain, le nombre de vigilantes a explosé face à une criminalité croissante contre laquelle la police se retrouve impuissante. Grimm en est un. Après un tragique événement, Grimm n’a plus qu’une chose en tête : la vengeance. ",5,https://belisairhouse.net/feuilletons/hero/,Français,checked,https://belisairhouse.net/feuilletons/hero/,,,,,,,"Grimm:Essaie de te débattre et je t'égorge comme un porc.

Helten:Ooooh je vois, la colère rend aveugle ET amnésique ? C’est nouveau ça… Et en même temps, c'est logique sinon tu te serais tiré une balle dans la tête depuis ce jour.

Helten, Grimm:Helten : Bravo… BRAVO ! Tu es le premier, Grimm… LE PREMIER à arriver jusqu’ici, tu peux vraiment être fier de toi ! Et maintenant-
Grimm : ET MAINTENANT TU VAS CREVER ! RAAAAAAAAAAAAAAH !

Grimm, un garde:Grimm : Parfait, où se situe l’armurerie ?
Garde : Heeeu j-j-je… Ici !
Grimm : Non ducon, ça, c’est une salle des armures ! OÙ SE SITUE L’ARMURERIE ?

Helten, Grimm, Mécha:Helten : On n'arrête pas le progrès ! Hé hé, on peut dire que mon petit invité…
Mécha : Lance-flamme activé.
Grimm : C’est une blague ?
Helten : ...brûlait d’impatience de te voir.

Helten, Grimm:Helten : Et quelle est cette vérité ?
Grimm : Tu es un meurtrier.
Helten : ...dit l’homme qui a déjà massacré plus d’une cinquantaine de mes vigiles…

Grimm, la secrétaire:Grimm : Un rendez-vous.
Secrétaire : M. Helten est très occupé. C’est pour quel motif s’il vous plait ?
Grimm : La vengeance.
Secrétaire : Hmmm je vois. M. Helten reçoit beaucoup de rendez-vous de ce type, malheureusement tout est occupé et… Oh mon Dieu, mais vous êtes armé !?
Grimm : Je prends le mien maintenant.

Grimm, un homme de main:Homme de main : Lâche ton arme ou on tire !
Grimm : Pourquoi attendre ?",Zeni1,,,,"Magero, Belisair House"
Héro,hero-oriog.jpg (https://dl.airtable.com/.attachments/7515ad8fdb48a6b20c39820545d69291/5e1606c0/hero-oriog.jpg),Terminé,"Ranne Madsen,Anya Kristen,Oriog Créations","Humour,Enfant",0:01,0:00,"« Perché en hauteur, les yeux fermés, j’avance un pied, me plaisant à imaginer le vide infini en dessous. Je visualise les passants surpris, me voyant les surplomber tous. Peut-être me voient-ils comme un héros dominant la ville, un justicier… Un dieu. »",5,https://podcloud.fr/podcast/oriog-creations/episode/hero,Français,checked,https://oriogcreations.fr/hero-et-toute-technologie-suffisamment-avancee/,,https://oriog-creations.lepodcast.fr/rss,,,,,,,,3. Noté,,"Ranne Madsen, Anya Kristen, Oriog Créations"
Horizons parallèles,horizons.jpg (https://dl.airtable.com/.attachments/9f28da75231c247b4dd52e511a10069e/ab03df50/horizons.jpg),En cours,Saïd,Science-Fiction,2:24,0:00,"Horizons parallèles est un projet littéraire ayant consisté à écrire et à publier sous licence libre une nouvelle d'anticipation par semaine pendant un an, entre 2018 et 2019. Après une publication numérique et la création de recueils papier cousus à la main, ce podcast vous propose de découvrir quelques-unes des nouvelles rédigées lors de ce projet hors du commun, dans une version audio inédite, lue par l'auteur. Bienvenue ailleurs, à un autre moment. Bienvenue dans les Horizons parallèles.",,https://horizons-paralleles.lepodcast.fr/,Français,checked,https://saidwords.org/histoires/,,https://horizons-paralleles.lepodcast.fr/rss,,https://open.spotify.com/show/5OvTKvq3K0RgbGJr3pcvCS,,,,TJP2020,,,,Saïd
Hôtel Gorgias,gorgias.jpeg (https://dl.airtable.com/.attachments/6b75f145c6c0c5cc015bab7a5fc20d21/07ed0a5d/gorgias.jpeg),Terminé,"Roman Facerias-Lacoste,La Fabrique des Parallèles","Thriller,Fantastique",1:23,0:00,"Cesco et Charlotte sont maîtres d'hôtel au Gorgias, un établissement de luxe qui propose à ses clients une prestation unique. Dans cet hôtel, le confort et le prestige ne sont pas ce que les visiteurs recherchent. Non, chacun y vient pour y trouver une forme de vérité.",,https://podcastaddict.com/podcast/3918620,Français,checked,https://podcastaddict.com/podcast/3918620,,https://feed.ausha.co/ErqO4uEl5WJ2,,https://open.spotify.com/show/6Q4YqYMMzfLS9rPe6EFCce?si=2b76d76362284c08&nd=1,,,,TJP2022,https://stitch.api.soundcast.fm/v1/ausha.mp3?soundcastId=627368fd3bfda&podcastUrl=https%3A%2F%2Faudio.ausha.co%2Fy0aeVc2gkDKD.mp3%3Ft%3D1651654693&from=PodcastAddict,,,"Roman Facerias-Lacoste, La Fabrique des Parallèles"
