Nom,Pochette,Statut,Auteur,Genre,Durée,Durée d'écoute,Synopsis,Note,Site,Langue,Dernier épisode,MP3,Website,Youtube,RSS,Soundcloud,Spotify,Discord,Récompense,Citation,Recommandation,Bande-annonce,NSI 2022,NSI 2023,Message Insta,Auteurs
Multicolore,big_66fd55987b1b8ccac929983a3521470dc479a800.jpg (https://v5.airtableusercontent.com/v1/18/18/1689292800000/8RVa5MShIyn9jGYpAfckQA/dumE4nOBl58yjUPt2D74_4WL3FU7XJWM6o8Tw2Ib4Xhnwuo5-tdYmdFawCV7oyUbblS7THxm0U1gzY-GOlNfOrX0-ccXKF3IwHGzjqncstG11zk4A4rxUmEIriO_mTWwdUAqSuI6YtrBykROcbve-Q/cM_0evWt2lZj5WpKSEyNrnJMRkQk6-lgwqSE5S6n6nA),Terminé,Mehdi B.,Fantastique,1:13,1 h 13 min,Des histoires sans titre.,,https://podcloud.fr/podcast/multicolore,Français,16/10/2022,,https://podcloud.fr/podcast/multicolore,,,,,,,,,,,1. À écouter,,Mehdi B.
Murs,murs.jpg (https://v5.airtableusercontent.com/v1/18/18/1689292800000/xuwNNEsnT6tC9oO5uaUIvg/fIzKGLiH4i6lHsaqD-uNA2Cnl5Ff--Ai0IDFWXo-h2qB77zLw6BMwochBZJ6cnS7Gyd6hfgh0atczrbpsZowQA/J9EhBjWQmRo2kiqiKNaVVSoS2_0x8ODkKcf7hHonBzw),Terminé,"Mishka Lavigne,Julien Morissette,Louis-Philippe Roy",Post-apo,,Non définie,"Au lendemain d'une épidémie qui décime presque toute la population, des survivants errent à la recherche d'un monde meilleur. Éric et Zoé, frère et sœur, marchent jusqu’à Portland, voulant savoir si leur père a aussi survécu. À leurs trousses, Sara, imprévisible, armée de sa carabine. Plus loin, un homme mystérieux. Des dangers les guettent à tous les tournants et, la nuit, des cauchemars les gardent éveillés.",,https://transistor.media/balados/murs,Français,,,https://www.lafabriqueculturelle.tv/balados/62/murs,,https://feeds.transistor.fm/murs,,https://open.spotify.com/show/7meO0oZnqLDlC6RJlHo5Ow,,,,"TJP2023,TJP",,,,,"Mishka Lavigne, Julien Morissette, Louis-Philippe Roy"
MUSA-028 : Les voix de l'extinction,musa.jpg (https://v5.airtableusercontent.com/v1/18/18/1689292800000/4i6wf_u5BLY0ZtrepjS2VA/pE0r8PTn6Ql_B6GqYqMa_QMICmApAIxQcJNd0xVGCdbiottIuwjbbX8vQHoW6eoboTcQ-HZuu7_pWyFGLj8EoQ/NnYXjDDu_OHfC6yHvBGqvU_-GYE7nTrt5j471zOuEZU),Terminé,Guillaume Reynaert,Science-Fiction,1:48,1 h 48 min,2152. La Terre se meurt et l'humanité avec elle. L'équipage de l'ISC Lynch est envoyé pour un aller simple à destination d'une galaxie inconnue.,,https://soundcloud.com/guillaume-reynaert/sets/musa-028,Français,,,https://www.facebook.com/MUSA.028.fiction/,https://www.youtube.com/channel/UC8j5gnBEVHpPG3os-AxZD0g,,https://soundcloud.com/guillaume-reynaert/sets/musa-028,https://open.spotify.com/show/1EM0LrGVuSFo5OEeKSsCX8,,,,"TJP2020,TJP",,,,,Guillaume Reynaert
Mystères à St-Jacut,mysteres.jpeg (https://v5.airtableusercontent.com/v1/18/18/1689292800000/0c2uvnfa9efuXevzTahzNA/DtoutHdO8GRcOYwgktbemon9vh2WvwUNAM2bX6pMfXfntHXUgLutgPSbJxmp8DLGNICFuRVu3FdsyJRbuzaf_XOWch9k1m9E_9UCBHb3bi0/grxrfMajiE9_d9Jt4tUIsmgruhQ0NsTp6VNdHrU82KU),Terminé,François Descraques,"Policier,Humour",15:24,15 h 24 min,"C'est un Soap mélangé à un Podcast. Un SoapCast comme on pourrait dire. Les trames sont écrites, mais elles sont découvertes en direct par les comédiens qui doivent improviser les dialogues. Et ça se passe en Bretagne.",5,https://www.youtube.com/watch?v=7bb6PrhFRzU&list=PLwplzg1cG01ug_0n8TW0oNWBokjV2FcsH,Français,,,https://www.youtube.com/watch?v=7bb6PrhFRzU&list=PLwplzg1cG01ug_0n8TW0oNWBokjV2FcsH,,,https://soundcloud.com/mysteres-a-st-jacut,https://open.spotify.com/show/5Hz7SjAI4iukwb3AMuxQu1?si=6OnyRTs_RVihPbyBPqpSoA&nd=1,,,,,,,,,François Descraques
Mythes & Légendes,mythes.jpg (https://v5.airtableusercontent.com/v1/18/18/1689292800000/yPAT6bZW_2i1tR3FYlVvbQ/WjCyaDYSQzAolQ_la7b9jmeOYEFCIpARKHKztPoCnZixS-mpV1PRlhXuShEzWzNaRytJRNXhs2yXQyAFN9OZtvjLlFSo9hiRiefcrWhcucM/3dHCaLRMxnZfOzRjomKIDP7SNlLDnSQi3RXUKpl7d38),En cours,Marc Jer,"Enfant,Historique",,Non définie,"Ulysse, Athena, Thor, Anubis, le roi Arthur, et bien d'autres... Quelle Histoire te fait découvrir les mythes et légendes du monde entier, comme tu ne les as jamais entendues.",5,https://mythes-et-legendes.lepodcast.fr/,Français,,checked,https://mythes-et-legendes.lepodcast.fr/,,https://mythes-et-legendes.lepodcast.fr/rss,,https://open.spotify.com/show/145gf6QoEMM5e7RxaT3Msn,,,,,,,,,Marc Jer
Mythologie - Mes histoires,mythologie.png (https://v5.airtableusercontent.com/v1/18/18/1689292800000/Qv4mH0XOaQKO7KxGsC-lqQ/_pMFpCc9tC2s3XVnO3_WYrJA6yMMfYZOZD7n2afQdIM2wLf_dFE-za14_uUyIJ_WLSmYD3tklrhBJ9KcotmXAqgVojQrbmAE_5ig7MFaPoc/b3f7MuNBvkNM2tWXcr2XKNOqSj3Lyvy9Axkkl3lIhkg),En cours,"François Vermorel,Studio KODOMO",Enfant,,Non définie,"🏛🌪🌎🧜🗡🇬🇷 Bonjour, je suis l’Oracle et je vais te raconter des histoires fabuleuses. Elles se déroulent en Grèce, il y a très longtemps. À cette époque, les dieux, les monstres et les héros vivent parmi les hommes. Ils s'appellent Zeus, Hercule, Ulysse, le Minotaure et il y en a encore bien d’autres ! Tu découvriras leurs aventures dans notre émission consacrée aux légendes de la Grèce ancienne dans ce Podcast “Mythologies - Mes histoires”",,https://play.acast.com/s/mythologie-mes-histoires,Français,,checked,https://studiominuit.com/podcast/28/mythologie-mes-histoires,,https://feeds.acast.com/public/shows/da210259-548f-46ee-acc6-d307fa5ed542,,,,,,,,,,,"François Vermorel, Studio KODOMO"
N00b,noob.jpg (https://v5.airtableusercontent.com/v1/18/18/1689292800000/AsEcHHw0XlmqWeFdJPCewQ/CrJvSNk0Kt_1ZG2Dv52VpkORe5QkL9gDxJcyFd98sRenlcI8BJr9GWLqA1GSvL2E1_tpW6sBxJmK5cNZfR3BMg/euprGI3Qe1X2HUNFnfSf7chvF7MFmjuBrNTLnBOoEwU),Terminé,Johana Beaussart,"Musical,Ambiance,Tranche-de-vie",0:19,19 min,"N00b se situe au carrefour de la fiction radio et de la pop expérimentale. Le récit oscille entre quotidien prosaïque et rêveries fantastiques. L’auditeur explore les fantasmes de l’auteur comme un joueur traverse les différents niveaux d’un jeu vidéo d’héroïc-fantasy. Il est embarqué, aspiré, régurgité d’un paysage à un autre, en constant aller-retour entre l’espace mental du personnage et celui de son quotidien.",,https://soundcloud.com/phonurgia-nova/johana-baussart_n00b,Français,,,https://soundcloud.com/phonurgia-nova/johana-baussart_n00b,,,,,,,,,,,,,Johana Beaussart
Nébuleuse,nebuleuse.jpg (https://v5.airtableusercontent.com/v1/18/18/1689292800000/kgqH0DEvusgyINQEm5w_hA/4pL1_DuJgSHp0PG8vRDLE8eYTiEbOcdcweiVHcudRWnRFOY02WKP_pEPt0-Ms5GydfFI9Z4PBtMyQOWh_hfiTkR33z0mGw0xbsK9uNPCVL0/8PbDm-SNJvG5pUNplyayoMnxAGzSY0ujd8e-Igde9Ug),Terminé,SilverCherry,Science-Fiction,0:41,41 min,"Quelque part dans l'espace, deux vaisseaux ennemis s'affrontent. Mike et Murak, un homme et un homme-roche membres de la Fédération, tentent d'éloigner ce vaisseau rebelle de leur base. Soudainement, l'alerte intrusion s'enclenche : Une jeune femme blessée et paniquée s'est téléportée dans leur vaisseau et les supplie de fuir le secteur.",5,https://nebuleuse.silvercherry.fr/,Français,,checked,https://nebuleuse.silvercherry.fr/,,https://silvercherry.fr/feed/nebuleuse,,,,,,,,,,,SilverCherry
Nemrod - Une histoire pour les enfants et leurs parents,nemrod.png (https://v5.airtableusercontent.com/v1/18/18/1689292800000/4cMGyIrlOW8fSdmAYxYq1A/ZFQPLBiq0D0aamlEhkIDoc_cW_GJ53jIr1Zuo-9z8KF8TS90_dWKM6SCvcagWlRAsbegTvE06-9a9x9TfLE71pMx_BAIGureU7gxXu7WUfc/_vVR1T5a9wEvuSbFkg6HSqIq1ycVKrDL84Nh6xRhARM),En cours,Sornac,"Enfant,Fantasy",,Non définie,"Dans un univers fantastique où les renards prennent des couleurs inhabituelles, Nemrod, jeune renard sentimental, découvrira le poids des apparences, la force des idéaux et la complexité du monde.",,https://podcasts.apple.com/fr/podcast/nemrod-une-histoire-pour-les-enfants-et-leurs-parents/id1533956851,Français,,,https://nemrod.io/,,,,,,,,,,,,,Sornac
Network Evil 6,network-evil-petit.jpg (https://v5.airtableusercontent.com/v1/18/18/1689292800000/-LS6rDYav9kKTdStMlAQAw/hzyeTfMLl7ExxXwyUEJk25p36QsDHOV5oeBaFnPHSGukdBfJZdF5lgerPhj1IUD6pYJAY38oAgjT_W89FmInRiywS1Go8Lx8BqwMaaJIw38/B3D6VW8SrFIIdWOvNCZ9c8IPs1AAGRhctqE7GWy6YRo),En cours,"Cladall,Kwaam","Licence,Post-apo,Action",2:10,2 h 10 min,"Léon & Héléna assignés à la protection du président des États-Unis vont devoir survivre à une attaque bioterroriste qui va causer l’infection de toute une ville. Chris et Pims, membres du BSAA, luttent contre le bioterrorisme à travers le monde. Cherry est à la recherche de Jacques pour affronter le nouveau virus qui se répand dans le monde. Quant à Abba, on ne sait pas pour qui elle travaille et pourquoi elle est mêlée à tout ça.",5,http://www.wavesavengers.fr/creations-audio/network-evil-6/,Français,,,http://www.wavesavengers.fr/creations-audio/network-evil-6/,https://www.youtube.com/playlist?list=PLJT6zV1wVvWypNmVYr4h5v7WkO_tRtB28,http://network-evil-6.lepodcast.fr/rss,,,,,,,,1. À écouter,1. À écouter,,"Cladall, Kwaam"
NOIR Jaune ROUGE - Belgian Crime Story,noirjaunerouge.png (https://v5.airtableusercontent.com/v1/18/18/1689292800000/dIQ363hN0uGviYhHDAG-tA/fOL_fW0lMW2Js1L8Sd3QX_IsOK2UaJCDXXCmHWWy1DGCDzbiBgU5IU1QJxs8wrxy5OlZTvUKhH6gCbBCqVyKF_j85LpBeXcuiYzUAZcJwHI/cDlEoG4ZrLNgkPhvRNYK3H3zxIzukM5C4cA6COinqCQ),En cours,RTBF,"Policier,Thriller,Documentaire",,Non définie,"200 ans d’histoires criminelles qui ont secoué la Belgique. Découvrez la 3e saison du podcast: De nouvelles histoires – basées sur des faits réels - par Barbara Abel, Mehdi Bayad, Juan d’Oultremont, Charlotte Dekoker, Christophe Bourdon. Le podcast Noir Jaune Rouge - Belgian Crime Story est une anthologie de fictions sonores écrites et interprétées par des autrices et auteurs belges, basées sur des histoires criminelles réelles du plat pays qui ont émaillé les XIXe et XXe siècles.",,https://podcasts.apple.com/qa/podcast/noir-jaune-rouge-belgian-crime-story/id1491370978,Français,,,https://auvio.rtbf.be/emission/noir-jaune-rouge-belgian-crime-story-15436,,,,,,,,,,,,,RTBF
Noises,noises.png (https://v5.airtableusercontent.com/v1/18/18/1689292800000/75LMT5bjgyolKF66Nx_hFA/zRXbukfREfEqy5_Un48jrl2mbQ3dHU8bhPimZAi-VCb1kjbI34MzqB1RDUupKqb2zmtTzPt3sDG_Jk0dLV7fBct3zeV8x4cUMZF17Xy-rMQ/57W22n4i5i50vUseX_pOgooWFAXePSw_VY9Kenr563o),En cours,Bababam,Tranche-de-vie,3:06,3 h 6 min,"Cette anthologie fait de l’ouïe le premier des 5 sens. Écoutez, ressentez, vibrez pour chacune de ses histoires. Plus besoin d’écrans pour vous donner de l’émotion.",5,https://play.acast.com/s/noises/,Français,,checked,https://podcasts.ba-ba-bam.com/noises/,,https://rss.acast.com/noises,,,,,,"TJP2019,TJP,Zeni1",https://sphinx.acast.com/noises/trailer-les3coups/media.mp3,,,,Bababam
Nouvelle vie,nouvelle-vie.png (https://v5.airtableusercontent.com/v1/18/18/1689292800000/DVXy19ko5OGVChYB62Uq2g/FPz5CKY1MsMiOQb527ZswcE5GPVCQsU0L5JYqMeTELE3-KkEccN3EblJJnhszD25LMFuQObY6xZt7GxGB7UEOsZq7E3jR1zzBQoJwCjBDrc/m_3vFG4wG_BvXh1nSybq1l1qnXP-jK_LsJLQ0WbDKY0),Terminé,So Good,Humour,,Non définie,"Cette histoire débute dans le tiroir d’une commode. Nos héros, Iph, Hua, Mo le vieux gsm et Sam, 4 téléphones intelligents - enfin plus ou moins - y sommeillent et se préparent à une nouvelle vie. Mais ils ne le savent pas encore. À quelle sauce seront recyclés nos smartphonus hibernatus ? Vont-ils être envoyés sur Mars ? Transformés en accessoire de curling ? Donnés à des enfants qui vont leur baver dessus ?",,https://shows.acast.com/nouvelle-vie,Français,,,https://www.sogoodstories.com/podcasts/nouvelle-vie/,,,,https://open.spotify.com/show/1W7mi5QnI5sBBurwQ9IoQ2,,,,,,,,,So Good
Nuit Blanche,nuitblanche.jpg (https://v5.airtableusercontent.com/v1/18/18/1689292800000/xjZRfCmVWkizl1hKfecyXA/U55Vw6Xwnmjfu8iunD6BLTfNMbV8Phzjc9h2pRRCoJmLmTNIEnP9w5HrU9DNxBQ4bQJHgDipMAqQw2eeN_N5N4lwg8SAcoXCB25eLaAv1PY/LoL2-KuTbJ6Y04kkntyk-OO0gU4mJ9SoZnKydgjKIEg),Terminé,"Sylvie Chaussée-Hostein,8000 Mondes",Thriller,0:50,50 min,"Dans les montagnes du nord-ouest américain, une violente tempête de neige s’annonce. Un tourment de plus pour Martha, qui tient à franchir le col de Werner cette nuit même. Alors qu’elle affronte une route dangereuse et verglacée, une autre tempête se déchaîne dans sa tête : celle du souvenir des dernières vacances en famille. L’irruption, dans cette nuit blanche, d’un étrange auto-stoppeur va tout bouleverser.",,https://soundcloud.com/8000mondes/nuit-blanche,Français,,checked,https://soundcloud.com/8000mondes/nuit-blanche,,,https://soundcloud.com/8000mondes/nuit-blanche,,,,,,,,,,"Sylvie Chaussée-Hostein, 8000 Mondes"
O.S. GATE,osg.jpg (https://v5.airtableusercontent.com/v1/18/18/1689292800000/ERUAbIq5sMc34S4chP5WdA/ZWx_R2cFkWA4Dru_I-bhJv7OgGGX2_nIWTkOr90DCsAd457XeQNWeZYHG5ZHvFUeWYYvwA938XrCMRzXYTL8cg/CJJjORQzVT3tnIxSU6-qfzVDKX9WEswLZvcfUai9wjg),Terminé,Khelian,"Science-Fiction,Post-apo,Horreur,Action",2:33,2 h 33 min,"Dans un monde en décomposition, peuplé de monstres et dont l’Essence se corrompt chaque jour un peu plus, un androïde se réveille dans une décharge. Un groupe de voyageurs lui demande son aide pour rejoindre leur seule chance de salut : une GATE, une des portes laissées par Dieu pour relier son monde au leur.",5,https://2020.sagadelete.fr/saga/os-gate-episodios,Français,13/9/2020,checked,https://khelian.wixsite.com/osgate/,,,,,,Nuit Sans Image,,"Club écoute,Zeni1",,,,,Khelian
Olma,olma.jpg (https://v5.airtableusercontent.com/v1/18/18/1689292800000/kGK9lA7mGsHNLrF3179Mdg/ZcVBNV4WtzcCnzgIlx88Yc3yHJ8JpZFT9rlPlBWWVjXOFSYteq0dTDNhV9fIjumpjWf1l77sZo5HRjjvCuWjeg/2CJPgjGM-JwaXMQoaoVeK9MhhvrDGR3hMhGFjDwUDT4),Terminé,"Mathieu Vidard,Lucie Sarfaty,France Inter","Enfant,Science-Fiction",,Non définie,France Inter invite les enfants de 8 à 12 ans à partir à la découverte des sciences.,5,https://www.franceinter.fr/emissions/olma,Français,,checked,https://www.franceinter.fr/emissions/olma,,http://radiofrance-podcast.net/podcast09/rss_21770.xml,,,,,,Zeni1,,,,,"Mathieu Vidard, Lucie Sarfaty, France Inter"
Olympe,olympe.jpg (https://v5.airtableusercontent.com/v1/18/18/1689292800000/TphImhZBXELPTi2MXuct9Q/divFRXcrJv7wJBpinkrwjtMWyM1QqhElOdqX16dmluwOKDolwmn3CpaTnAVkI7S3xLxAd5jC4vhAwjFO-dSfC1rSRsAnXyJftS0q3uumsaU/ZZj8qUzJGc8snZ5vHcGbTsrqUy8sZQkv2NBYQxsfv4w),Terminé,Matthieu Dujardin,"Humour,Historique",0:55,55 min,"Saga de fictions audio humoristiques dans l'univers de la mythologie grecque ! Les vignettes titrées simplement ""Olympe"" content de vrais récits de la mythologie grecque, celles titrées ""Olympe mythes alternatifs"" content des histoires inventées dans le même univers.",,https://soundcloud.com/user-967046471/sets/olympe,Français,,checked,https://soundcloud.com/user-967046471/sets/olympe,,,https://soundcloud.com/user-967046471/sets/olympe,https://open.spotify.com/playlist/21ZiBeEhljdLTyj1NeQFBc,,,,"TJP2019,TJP",,,,,Matthieu Dujardin
On a failli sauver le monde,sauver-le-monde.png (https://v5.airtableusercontent.com/v1/18/18/1689292800000/dAAZKJkTyzomgvHmDCl31A/lfynRlnubhshdG9Zxfo8uDTaDkFvKJ4aYRNxrFI2lCnPxS8j1dp7nT_uv5b5d0mxy627WRw4yTdv_e3x5AtV3iHkGh4Bil2BUcsavrh-1iU/PztLbkKj3_Dk8nWI7wdThN5prt_3WULQSXuesMrgZsQ),Terminé,Vincent Édin,"Science-Fiction,Post-apo,Politique",1:04,1 h 4 min,"Année 2126. Nicolas, directeur de Passion RSE, think tank humaniste réfléchissant au rôle que peuvent jouer les entreprises pour avancer vers un monde meilleur, est à bord du vol 666 de la compagnie Hope, à destination de la planète New Eden, propriété d'Amazon. Nicolas a dû fuir la Terre, en proie à un réchauffement climatique invivable et les émeutes sociales qui vont avec. Parti pour un voyage solitaire de 2 ans, Nicolas est en pleine introspection et se demande si, pendant toutes ces années à la tête de Passion RSE, il n’a pas fait fausse route.",,https://shows.acast.com/on-a-failli-sauver-le-monde,Français,,,https://shows.acast.com/on-a-failli-sauver-le-monde,,https://feeds.acast.com/public/shows/on-a-failli-sauver-le-monde,,,,,,,,,,,Vincent Édin
Ondes de Choc,ondes.jpg (https://v5.airtableusercontent.com/v1/18/18/1689292800000/zLMGuxF_KAUv09dbJRSirQ/EXjDnXilcCnIXH0-4fp7r5NvQCTa3CsqyXYNHYEh5rdq7VOVbTkTWqdfufEfpjiFfvg1LFX_jmpVxZwzAWQlXAIxIM_TvlWnescpjQkJw_k/DtsWD5epcgfweiiZLEG56GtO5_1FwiGuKSl4T7nnZho),Terminé,"Sylvie Chaussée-Hostein,8000 Mondes","Thriller,Policier,Politique",7:34,7 h 34 min,"Que feriez-vous si vous découvriez que vos anciens camarades de lycée meurent mystérieusement les uns après les autres ? Élixène Murat n’hésite pas : elle veut enquêter. Y a-t-il un lien entre ces meurtres et la féroce campagne électorale pour la Présidentielle, à laquelle prend part l’un des ex-élèves de la Seconde B ? Une quête de vérité semée de dangers, où intérêts personnels, politiques et financiers tressent entre le passé et le présent une nasse inextricable.",,https://www.youtube.com/watch?v=H3So4ZhhlTc&list=PLS5yJA4qrZBmUuGH_hio3gAY3tKLpcDsn,Français,7/7/2022,,https://www.youtube.com/watch?v=H3So4ZhhlTc&list=PLS5yJA4qrZBmUuGH_hio3gAY3tKLpcDsn,https://www.youtube.com/watch?v=H3So4ZhhlTc&list=PLS5yJA4qrZBmUuGH_hio3gAY3tKLpcDsn,,https://soundcloud.com/8000mondes/sets/ondes-de-choc-un-thriller-audio-en-12-episodes,,,,"Fanny:Les hommes, c'est comme les cheveux. Quand tu n'arrives plus à en faire ce que tu veux, la seule solution, c'est de les plaquer !

Jean-François:Alors, vous allez vous sortir les doigts du cul, hein ! Et moi, je viendrai personnellement les sentir tous les matins pour vérifier s'ils sont propres !

Jean-François:Murat ! Si elle te vire par la porte, tu rentres par la fenêtre. Si elle te vire par la fenêtre, tu rentres par la cheminée. Tu serais mignonne en Père Noël...

Mme Dumas:Il se donne des airs respectables. Mais si on veut monter au cocotier, il vaut mieux avoir les fesses propres.",Zeni1,,,1. À écouter,,"Sylvie Chaussée-Hostein, 8000 Mondes"
Opération Cookies,cookies.jpg (https://v5.airtableusercontent.com/v1/18/18/1689292800000/UwKiNImrAqXg_jJoHVe65w/5u7brp5SQwAfuEB3pix0yY_Sml_3djbInl1XX2_pe4KggJdTC6LFzt1PdMIbSeKnaLjDZrYciPhzwtCKbvR83Xj_ad8PzDGEZBMAX4YMXjs/a4jifFfyzFqoxH0VVDtm47wUptIKakTOOJvVjE4jzIg),Terminé,JPPJ,Action,0:19,19 min,"Agent H et Agent C sont les meilleurs dans leur domaine. C'est pourquoi lorsque l'organisation leur confie une mission de la plus haute importance (dont déprendra certainement l’avenir de l’humanité), ils n’hésitent pas une seule seconde avant de se lancer au cœur de l’action. Des rebondissements incroyables, des scènes à couper le souffle, des effets spéciaux au-delà de l’imaginable, préparez-vous à écouter l’une des aventures d’espionnage les plus palpitantes des dernières décennies. Attachez vos ceintures, c’est l’heure de lancer l’Opération Cookies !",5,https://2021.sagadelete.fr/saga/operation-cookies,Français,,checked,https://2021.sagadelete.fr/saga/operation-cookies,,,,,,,,,,3. Noté,,,JPPJ
Opération K-K Wet,Operation-k-k-wet.jpg (https://v5.airtableusercontent.com/v1/18/18/1689292800000/FT2weJ5adbUFcTJimSPlJQ/qD65x06WzBZyQ97sNLG0vyZhMN1Y50Dj6WdqD3K0KjtjOsq1Ct_T7W-QLiLVu7E7DgOFfYtfuNiiY18c8DcovLovaEojrAe5q2NB8ScH8wk/VOasu7GMPovatsShGBro_SjId0BGFGk7uvZMnLJs6CM),Terminé,Geek Forever Prod,"Fantastique,Action,Enfant",0:17,17 min,"Lors d'une sombre nuit, le hamster dévastateur, que l'on nomme ""Bulldozer"", met au point un plan d'évasion à toute épreuve. Il est bien décidé à quitter la maison pour de bon, quoi qu'il en coûte. Une épopée épique inspirée de faits réels.",,https://geekforeverprod.wixsite.com/geek-forever-prod/op%C3%A9ration-k-k-wet,Français,11/12/2022,checked,https://geekforeverprod.wixsite.com/geek-forever-prod/op%C3%A9ration-k-k-wet,,,,,,,,Zeni1,,,2. À noter,,Geek Forever Prod
Opération Lima,lima.png (https://v5.airtableusercontent.com/v1/18/18/1689292800000/_lTCcE2Meh2VvtPize_KPQ/wrMbFD_NSf8zYlEOPWTRTpoWMjYZFdUa10iHF2HjSQIUhqEfat5Dg0bh2eZyvVbEeK1fFdM0vxy6_mDcTIgj6Q/_T6UZ-Am2CVZI-9oYqmTo2gOky1I5RMQDsuvKMykDdA),Terminé,"Vincent Hazard,Cédric Aussir,France Culture","Policier,Politique",3:27,3 h 27 min,"Avril 2021, Mia, 8 ans est enlevée au domicile de sa grand-mère. Derrière ce qui pourrait sembler une simple affaire de garde d'enfant, les gendarmes découvrent des protagonistes tous unis dans une vision complotiste du monde et une organisation menée par un certain Rémy Daillet.",,https://www.radiofrance.fr/franceinter/podcasts/serie-operation-lima,Français,,,https://www.radiofrance.fr/franceinter/podcasts/serie-operation-lima,,,,,,,,Zeni1,,,,,"Vincent Hazard, Cédric Aussir, France Culture"
Oranu - Mes Chers Démons,demons.jpg (https://v5.airtableusercontent.com/v1/18/18/1689292800000/aCOsP_jvYj7GwAJhp-DTnA/439X8_0i31IOjNrYOt36jEt3HdJRvadtC6s06t9PrMKjgcua89fYd-Td4kbQcRlr3GWCUCaLNwQPAdvEPswp81Kqs2Mff5OAKw5y4PGD4nQ/AXQld1vt_1SKrn5-pmULF5wuxzE1RO94KCcSE3yigzY),Terminé,"Miss Aphya,Audiodidact",Science-Fiction,0:31,31 min,"Après sa défaite cuisante contre James Rico, Gwenn Douarnez, aussi connu sous le nom du Fils de la Mort, se retrouve sous les barreaux, le cœur rongé par la haine et la rancœur. Mais il devra faire face à l'une de ses plus anciennes ennemies : la solitude.",5,https://www.youtube.com/watch?v=Og4FDA0E8yE,Français,,,https://www.youtube.com/watch?v=Og4FDA0E8yE,https://www.youtube.com/watch?v=Og4FDA0E8yE,,,,,,,,,4. Hors concours,,,"Miss Aphya, Audiodidact"
Origin,origin.jpeg (https://v5.airtableusercontent.com/v1/18/18/1689292800000/5p8zcaeKgdQGhD0L-YyprA/j2wODx-eSltuWySoPEmsE-YNjK1YVxPGyLNfQTZ1MXHig1dinK5X95Ju7E__Gb6fcHzEiAi3_6cGG7f8mghorJi_nSWluuYXOgWL1RMr5vc/3XHeHKEsCVjp_jRBjo_gnJBhN2JNcM2kSJfnmbJ7ofQ),Terminé,EM Normandie,"Science-Fiction,Thriller,Action",1:30,1 h 30 min,"Nous sommes en 2079. Youssra rêve de vivre sur Mars. Elle saisit sa chance lorsque son école, l'EM Normandie, offre quelques places dans son campus sur la première ville martienne : Origin. La soirée tant attendue de l'annonce des lauréats réserve à Youssra et sa meilleure amie un destin tout autre qu'espéré. Du campus du Havre au vaisseau OriginOne, Youssra se retrouve au centre du clivage pro-Terre/pro-Mars et va devoir s'affranchir du poids de l'héritage familial. ",,https://podcast.ausha.co/origin,Français,,checked,https://podcast.ausha.co/origin,,https://feed.ausha.co/yv8QQSY2GDd2,,https://open.spotify.com/show/2sZ2HxGv6fU4tSmsk263pI,,,,,,,,,EM Normandie
Ornain,ornain.jpg (https://v5.airtableusercontent.com/v1/18/18/1689292800000/nrfeeVvVcu1nA6S-YDeyNA/EeKQHA-dwSrHM3AdjcbAz7O8wrRBbMs0Mlhh0rxTQ_SXz8Pewf4sYi9cLGNhXGuCdqkrAl1Gm8I0zuedI803tFwePOBMjpz-LeftO0yRvEc/d-Alu5219Qru1AwctxfdI9f8YCOfM8lca7Y46E57Q8A),Terminé,"FibreTigre,Qualiter",Policier,2:09,2 h 9 min,"Faux papiers, fraude fiscale, drogue, paranormal et mosquées illégales, notre solution pour doper l'économie en milieu rural. Ornain est notre 2e fiction, entre humour et grand banditisme, pour vous faire découvrir un département trop méconnu : la Meuse.",5,https://shows.acast.com/fiqtion,Français,9/3/2020,checked,https://shows.acast.com/fiqtion,,https://rss.acast.com/fiqtion,,https://open.spotify.com/show/30tdjVW84cMnYeqxvc5WwN,,,,"Club écoute,Zeni1",,,,,"FibreTigre, Qualiter"
Out of Control,out-of-control.jpg (https://v5.airtableusercontent.com/v1/18/18/1689292800000/0EAPd2UiiRrIU87qGwe8BQ/vFvFEG11lRWSoiUhBTrV3kYRMQJlmrvZ5UTnuMGQSygkJelz0n-M5NtbC8mVlyqY0NPuRvMoZBN3cbmg6TaRyuvWFQ_5pO6TDKrc2woo_Dk/eZbdl5K901BSZGUMSCTxIuMXMJNCIru9kwu0FaL76cs),Terminé,"Ranne Madsen,Draignaell,Oriog Créations",Fantastique,0:36,36 min,"L’Instance. Depuis désormais 15 ans, cette organisation permet à tout membre adulte de la population d’avoir des pouvoirs pendant toute une journée, sans autre limite que le temps, et ce, via une loterie mondiale. Mais c’est aujourd’hui l’anniversaire de l’Instance, et ils tentent, de fait, une expérience des plus risquées : donner des pouvoirs à quatre personnes en même temps. Mais hélas, tout dérape. Baptiste, Alice, Jessie et Gaëlle se retrouvent, sans le vouloir, avec des capacités surnaturelles. Sans contrôle, hors des radars, la puissance de ces pouvoirs peuvent faire perdre la raison. Et vous ? Vous feriez quoi si vous étiez surhumain pendant une journée ?",5,https://2016.sagadelete.fr/saga/out-of-control,Français,,checked,https://oriogcreations.fr/podcast/out-of-control-episode-1/,,,,,,Saga de l'été,,,,,,,"Ranne Madsen, Draignaell, Oriog Créations"
Out There,outthere.png (https://v5.airtableusercontent.com/v1/18/18/1689292800000/ZUx44u5IFKOtbBBQp47QMA/lp4Rg8LSlByAOUZGUxZAgXJINgyeJ9j3yJBJnNcz-2kGYve8yUQmrobdlLKWJTSgCMA-vOyv_0Ao3ASV_HbBLqZzPftunY5I7AjuoLT4noQ/frX-jd5ukWbBA-H_OA4ptb6B-pqoT-u-yJ1tM6MzlqE),Terminé,"François TJP,Studio TJP",Science-Fiction,0:05,5 min,Une fan-fiction du jeu vidéo de Mi-Clos Studio et FibreTigre.,,https://www.studiotjp.com/download/out-there/,Français,1/2/2015,,https://www.studiotjp.com/download/out-there/,,,,,,,,,,,,,"François TJP, Studio TJP"
Overkiller,Overkiller_EP01-mp3-image-300x169.jpg (https://v5.airtableusercontent.com/v1/18/18/1689292800000/vs5OgYULmfI1cOAH3ECCUQ/tKKOmAj-LkEQmmIK5P6pKWu91jtFtjZHvsB-r0XBS8rkHy2YJvJNF5sYd_yZA_0olX_nyJ4hH23hcvkjYRF6T_lBrwM4IT9p50vSp5jSYoRmSf6254Ccb2-deG9xgO9L/UdGb35nXHg6ru0UVEWIC2scjCFvCG9Y1OCEkkuR0zqg),En cours,"Fred Mansour,Julien Cros",Humour,0:30,30 min,"Une aventure de Lancelot Dupuis, un tueur à gage très peu professionnel et de son acolyte Ethan, un jeune chômeur très défoncé :smt033
",,https://overkiller.fr/saga-audio/,Français,,checked,https://overkiller.fr/saga-audio/,https://www.youtube.com/watch?v=5EwiMkfuMyI&list=PLN2C8-4n7uA2okWu_3ugOspRHVE63Ozv-,,https://soundcloud.com/lancelot-dupuis/sets/overkiller-la-saga-audio-1,,,,,,,,,,"Fred Mansour, Julien Cros"
